CODIGO,DISTRITO,DEPARTAMENTO,MUNICIPIO,ESTABLECIMIENTO,DIRECCION,TELEFONO,SUPERVISOR,DIRECTOR,NIVEL,SECTOR,AREA,STATUS,MODALIDAD,JORNADA,PLAN,DEPARTAMENTAL
01-08-0413-45,01-409,GUATEMALA,MIXCO,COLEGIO HISPANO GUATEMALTECO FINDE,9A. CALLE 7-30 ZONA 3 COL. NUEVA MONTSERRAT,56963332,DELMY CONSUELO GARCIA DONIS DE GOMEZ,VICTOR MANUEL HERRERA GALINDO,BASICO,PRIVADO,URBANA,ABIERTA,MONOLINGUE,DOBLE,FIN DE SEMANA,GUATEMALA OCCIDENTE
01-08-0414-45,01-604,GUATEMALA,MIXCO,COLEGIO AGUSTINIANO,5A AVENIDA CONDADO NARANJO 23-55 ZONA 4,23008686,EMORA EMPERATRIZ CRUZ DE FUENTES,JORGE LUIS PERALTA GARCÍA,BASICO,PRIVADO,URBANA,ABIERTA,MONOLINGUE,MATUTINA,DIARIO(REGULAR),GUATEMALA OCCIDENTE
01-08-0416-45,01-401,GUATEMALA,MIXCO,CENTRO EDUCATIVO FIORE,12 CALLE 1-79 ZONA 3 COLONIA EL ROSARIO,24390381,IXMUCANE ALDANA VILLAVICENCIO,WENDY JULISSA LÓPEZ MIJANCOS,BASICO,PRIVADO,URBANA,CERRADA TEMPORALMENTE,MONOLINGUE,MATUTINA,DIARIO(REGULAR),GUATEMALA OCCIDENTE
01-08-0419-45,01-607,GUATEMALA,MIXCO,COLEGIO DE INFORMÁTICA JUSTO RUFINO BAUTISTA,7A AVENIDA 11-40 COLONIA PRIMERO DE JULIO ZONA 5,24362000,OLGA MARINA AJQUEJAY SALOJ DE TUBAC,MARCELA FLORIDALMA ZAPET JACOBO,BASICO,PRIVADO,URBANA,ABIERTA,MONOLINGUE,MATUTINA,DIARIO(REGULAR),GUATEMALA OCCIDENTE
01-08-0423-45,01-603,GUATEMALA,MIXCO,COLEGIO BILINGUE EDUCATE,CALZADA ROOSEVELT KM. 13 10-86 ZONA 2 DE MIXCO,41551697,ROSA ALBELIA ARDON DE MOTTA,ANNABELLA CORDON CAMPOS DE LEMUS,BASICO,PRIVADO,URBANA,ABIERTA,MONOLINGUE,MATUTINA,DIARIO(REGULAR),GUATEMALA OCCIDENTE
01-08-0426-45,01-615,GUATEMALA,MIXCO,COLEGIO VALLADOLID DE GUATEMALA,13 AVENIDA 8-51 ZONA 6 COLONIA VILLAFLOR,23330352,LILIANA MARINA FLORES JIMENEZ,AURA CONSUELO MORALES ALVAREZ,BASICO,PRIVADO,URBANA,ABIERTA,MONOLINGUE,MATUTINA,DIARIO(REGULAR),GUATEMALA OCCIDENTE
01-08-0429-45,01-409,GUATEMALA,MIXCO,CENTRO EDUCATIVO SAN JOSÉ,"5A. AVENIDA 16-86, COLONIA COLINAS DE MINERVA ZONA 11",44477567,DELMY CONSUELO GARCIA DONIS DE GOMEZ,MIRIAM MENDEZ VASQUEZ DE CARIAS,BASICO,PRIVADO,URBANA,CERRADA TEMPORALMENTE,MONOLINGUE,DOBLE,FIN DE SEMANA,GUATEMALA OCCIDENTE
01-08-0430-45,01-409,GUATEMALA,MIXCO,CENTRO EDUCATIVO SAN JOSÉ,5A. AVENIDA 16-86 COLONIA COLINAS DE MINERVA ZONA 11,44477567,DELMY CONSUELO GARCIA DONIS DE GOMEZ,MIRIAM MENDEZ VASQUEZ DE CARIAS,BASICO,PRIVADO,URBANA,ABIERTA,MONOLINGUE,DOBLE,FIN DE SEMANA,GUATEMALA OCCIDENTE
01-08-0433-45,01-409,GUATEMALA,MIXCO,COLEGIO EN COMPUTACIÓN SAN JOSÉ NO. 1,3A. CALLE 14-95 COLONIA NUEVA MONSERRAT ZONA 3,51008683,DELMY CONSUELO GARCIA DONIS DE GOMEZ,THELMA PATRICIA HURTADO ZUÑIGA,BASICO,PRIVADO,URBANA,CERRADA TEMPORALMENTE,MONOLINGUE,MATUTINA,FIN DE SEMANA,GUATEMALA OCCIDENTE
01-08-0435-45,01-409,GUATEMALA,MIXCO,COLEGIO EN COMPUTACIÓN SAN JOSÉ NO. 1,"3A. CALLE 14-95 ZONA 3, COLONIA NUEVA MONTSERRAT",51008683,DELMY CONSUELO GARCIA DONIS DE GOMEZ,THELMA PATRICIA HURTADO ZUÑIGA,BASICO,PRIVADO,URBANA,CERRADA TEMPORALMENTE,MONOLINGUE,DOBLE,FIN DE SEMANA,GUATEMALA OCCIDENTE
01-08-0436-45,01-401,GUATEMALA,MIXCO,COLEGIO EN COMPUTACIÓN SAN JOSÉ NO. 1,"3A. CALLE 14-95 ZONA 3, COLONIA NUEVA MONTSERRAT",51008683,IXMUCANE ALDANA VILLAVICENCIO,THELMA PATRICIA HURTADO ZUÑIGA,BASICO,PRIVADO,URBANA,CERRADA TEMPORALMENTE,MONOLINGUE,DOBLE,FIN DE SEMANA,GUATEMALA OCCIDENTE
01-08-0443-45,01-608,GUATEMALA,MIXCO,CENTRO EDUCATIVO NUESTRA SEÑORA DE LA ESTRELLA,11 AVENIDA 19-97 COLONIA PEREZ GUISASOLA ZONA 10,51270468,EDGAR ALBERTO SIMON CHALI,THELMA LORENA VASQUEZ RAMIREZ,BASICO,PRIVADO,URBANA,ABIERTA,MONOLINGUE,MATUTINA,DIARIO(REGULAR),GUATEMALA OCCIDENTE
01-08-0444-45,01-607,GUATEMALA,MIXCO,COLEGIO REY DE JUSTICIA,"4A. AVENIDA 0-13 ZONA 5, COLONIA SANTA MARTA",24380024,OLGA MARINA AJQUEJAY SALOJ DE TUBAC,BLANCA ISABEL GALVEZ GARCIA,BASICO,PRIVADO,URBANA,ABIERTA,MONOLINGUE,MATUTINA,DIARIO(REGULAR),GUATEMALA OCCIDENTE
01-08-0447-45,01-609,GUATEMALA,MIXCO,INSTITUTO TECNOLOGICO PRIVADO DE GUATEMALA,"22A. AVENIDA 11-86 INTERIOR SECTOR GRANJAS ZONA 8, CIUDAD SAN CRISTOBAL",34844039,SILVIA HORTENSIA GONZALEZ MARTINEZ,ALVARO GUILLERMO ARELLANO RODAS,BASICO,PRIVADO,URBANA,CERRADA TEMPORALMENTE,MONOLINGUE,MATUTINA,DIARIO(REGULAR),GUATEMALA OCCIDENTE
01-08-0450-45,01-609,GUATEMALA,MIXCO,COLEGIO FELIZ,4A. AVENIDA 8-36 BALCONES DE SAN CRISTOBAL III ZONA 8,24783580,SILVIA HORTENSIA GONZALEZ MARTINEZ,EDGAR LEONEL CARDONA JUAREZ,BASICO,PRIVADO,URBANA,ABIERTA,MONOLINGUE,MATUTINA,DIARIO(REGULAR),GUATEMALA OCCIDENTE
01-08-0455-45,01-619,GUATEMALA,MIXCO,COLEGIO EXPERIMENTAL CRISTIANO VERBO NO. 2,"27 AVENIDA 8-36, EL NARANJO, ZONA 4",22104862,JUAN WALDEMAR CABRERA MENDEZ,CLAUDIA LORENA GARZONA NOLASCO DE PICHIYA,BASICO,PRIVADO,URBANA,ABIERTA,MONOLINGUE,MATUTINA,DIARIO(REGULAR),GUATEMALA OCCIDENTE
01-08-0465-45,01-639,GUATEMALA,MIXCO,"LICEO CANADIENSE, SOCIEDAD ANONIMA","9A. AVENIDA 0-55 ZONA 2, COLONIA ALVARADO",23750061,ANDREA VANESSA ALDANA VILLAGRAN DE CASTRO,SUSAN GLORIANA SALAZAR FIGUEROA,BASICO,PRIVADO,URBANA,ABIERTA,MONOLINGUE,DOBLE,A DISTANCIA,GUATEMALA OCCIDENTE
01-08-0469-45,01-621,GUATEMALA,MIXCO,LICEO SANTANDER,8A AV. 00-62 Z. 1,24344845,MARTA LUZ BETETA ORTIZ DE JORDAN,HORTENSIA AMPARO GONZÁLEZ RAMIREZ,BASICO,PRIVADO,URBANA,ABIERTA,MONOLINGUE,VESPERTINA,DIARIO(REGULAR),GUATEMALA OCCIDENTE
01-08-0473-45,01-616,GUATEMALA,MIXCO,"CENTRO EDUCATIVO ""TORRE FUERTE""",2O CALLE 3-00 COLONIA SAN FRANCISCO I ZONA 6,54677607,RENE SAZO NAVICHOQUE,YULI ANDREA LOPEZ AGUILAR,BASICO,PRIVADO,URBANA,ABIERTA,MONOLINGUE,MATUTINA,DIARIO(REGULAR),GUATEMALA OCCIDENTE
01-08-0477-45,01-621,GUATEMALA,MIXCO,LICEO EDUCATIVO MIXTO SPENCER,"2A. CALLE 8-20 APTO. ""A"" ZONA 1",24387346,MARTA LUZ BETETA ORTIZ DE JORDAN,VILMA ARACELY ZUNCAR PINEDA DE NAVAS,BASICO,PRIVADO,URBANA,ABIERTA,MONOLINGUE,MATUTINA,DIARIO(REGULAR),GUATEMALA OCCIDENTE
01-08-0478-45,01-621,GUATEMALA,MIXCO,LICEO EDUCATIVO MIXTO SPENCER,"2A. CALLE 8-20 APTO. ""A"" ZONA 1",24387346,MARTA LUZ BETETA ORTIZ DE JORDAN,VILMA ARACELY ZUNCAR PINEDA DE NAVAS,BASICO,PRIVADO,URBANA,ABIERTA,MONOLINGUE,VESPERTINA,DIARIO(REGULAR),GUATEMALA OCCIDENTE
01-08-0481-45,01-608,GUATEMALA,MIXCO,COLEGIO MIXTO NUEVA JERUSALÉN,"22 CALLE 12-30 COL. SAN FRANCISCO , SAN JOS LA COMUNIDAD ZONA 10",52923380,EDGAR ALBERTO SIMON CHALI,PEDRO ISIDRO RODRÍGUEZ ARANA,BASICO,PRIVADO,URBANA,ABIERTA,MONOLINGUE,MATUTINA,DIARIO(REGULAR),GUATEMALA OCCIDENTE
01-08-0498-45,01-615,GUATEMALA,MIXCO,"CENTRO EDUCATIVO ""EL VIÑADOR""",BOULEVARD SACOJ GRANDE 71-80 ZONA 6,24849886,LILIANA MARINA FLORES JIMENEZ,ANDREA PERNILLO FUENTES,BASICO,PRIVADO,RURAL,ABIERTA,MONOLINGUE,VESPERTINA,DIARIO(REGULAR),GUATEMALA OCCIDENTE
01-08-0503-45,01-639,GUATEMALA,MIXCO,CENTRO DE FORMACIÓN EXTRAESCOLAR TIJOB'AL RUK'U'X NA'OJ,KM. 15 CALZADA ROOSEVELT Y 0 AVENIDA 13-70 ZONA 3,25011755,ANDREA VANESSA ALDANA VILLAGRAN DE CASTRO,MARÍA ELIZABETH BALÁN GÓMEZ,BASICO,PRIVADO,URBANA,CERRADA TEMPORALMENTE,MONOLINGUE,DOBLE,FIN DE SEMANA,GUATEMALA OCCIDENTE
01-08-0504-45,01-639,GUATEMALA,MIXCO,CENTRO DE FORMACION EXTRAESCOLAR TIJOB'AL RUK'U'X NA'OJ,KM 15 CALZADA ROOSEVELT Y 0 AVENIDA 13-70 ZONA 3,25011755,ANDREA VANESSA ALDANA VILLAGRAN DE CASTRO,LIC. ALFONSO EFRAIN TZAQUILTZAL ZAPETA,BASICO,PRIVADO,URBANA,ABIERTA,MONOLINGUE,DOBLE,FIN DE SEMANA,GUATEMALA OCCIDENTE
01-08-0509-45,01-609,GUATEMALA,MIXCO,LICEO CRISTIANO FRATER SEDE SAN CRISTOBAL,1A. CALLE 18-81 SECTOR B-1 CIUDAD SAN CRISTOBAL ZONA 8,22433031,SILVIA HORTENSIA GONZALEZ MARTINEZ,PATRICIA CAROLINA MARTINEZ MONZÓN,BASICO,PRIVADO,URBANA,ABIERTA,MONOLINGUE,MATUTINA,DIARIO(REGULAR),GUATEMALA OCCIDENTE
01-08-0516-45,01-606,GUATEMALA,MIXCO,"LICEO CRISTIANO ""ABBA PADRE""","20 AVENIDA ""A"" 2-76 RESIDENCIALES EL VALLE ZONA 11",24833366,MARIA ISABEL OLIVA NAJERA,MÓNICA EUGENIA OVANDO VILLATORO,BASICO,PRIVADO,URBANA,ABIERTA,MONOLINGUE,MATUTINA,DIARIO(REGULAR),GUATEMALA OCCIDENTE
01-08-0517-45,01-606,GUATEMALA,MIXCO,"LICEO MIXTO ""EMANUEL""","12 AVENIDA ""A"" 0-80 LO DE FUENTES ZONA 11",23083871,MARIA ISABEL OLIVA NAJERA,IRMA YOLANDA CORADO ALMIREZ,BASICO,PRIVADO,URBANA,ABIERTA,MONOLINGUE,VESPERTINA,DIARIO(REGULAR),GUATEMALA OCCIDENTE
01-08-0518-45,01-621,GUATEMALA,MIXCO,COLEGIO TECNOLÓGICO MODERNO VYGOTSKI,2A. CALLE 8-55 ZONA 1,47651449,MARTA LUZ BETETA ORTIZ DE JORDAN,CLAUDIA YANETH SIAN BURRION,BASICO,PRIVADO,URBANA,ABIERTA,MONOLINGUE,MATUTINA,DIARIO(REGULAR),GUATEMALA OCCIDENTE
01-08-0524-45,01-616,GUATEMALA,MIXCO,"COLEGIO MIXTO TECNOLOGÍCO ""LA MAGIA DEL SABER""",1A. CALLE LOTE 18 MANZANA I SECTOR 4 SAN JOSE LAS ROSAS ZONA 6,49658219,RENE SAZO NAVICHOQUE,MIRIAM JOHANA JANETH CHAMALÉ LÓPEZ DE HIGUEROS,BASICO,PRIVADO,URBANA,ABIERTA,MONOLINGUE,VESPERTINA,DIARIO(REGULAR),GUATEMALA OCCIDENTE
01-08-0526-45,01-608,GUATEMALA,MIXCO,CENTRO EDUCATIVO ACADEMIA DE NIÑOS,3A. CALLE 1-80 Y 1-23 ZONA 10 SAN JACINTO,54824933,EDGAR ALBERTO SIMON CHALI,EULALIA CASTRO SAGUACH DE IXCOT,BASICO,PRIVADO,URBANA,ABIERTA,MONOLINGUE,MATUTINA,DIARIO(REGULAR),GUATEMALA OCCIDENTE
01-08-0527-45,01-602,GUATEMALA,MIXCO,PEDAGÓGICO INTEGRAL SAN MIGUEL,6A. AVENIDA 14-15 LO DE COY ZONA 1,56437126,FAJARDO LOPEZ MARTINEZ,DAYRIN ESTEFANY ZAMORA VALENZUELA DE BRIONES,BASICO,PRIVADO,RURAL,ABIERTA,MONOLINGUE,VESPERTINA,DIARIO(REGULAR),GUATEMALA OCCIDENTE
01-08-0536-45,01-621,GUATEMALA,MIXCO,CENTRO ESCOLAR UNIVERSAL,4A. AVENIDA 2-24 ZONA 1,57590213,MARTA LUZ BETETA ORTIZ DE JORDAN,MARCIA DE JESÚS JIMÉNEZ LÓPEZ,BASICO,PRIVADO,URBANA,ABIERTA,MONOLINGUE,MATUTINA,DIARIO(REGULAR),GUATEMALA OCCIDENTE
01-08-0543-45,01-606,GUATEMALA,MIXCO,CENTRO EDUCATIVO SAN JOSÉ,"5A. AVENIDA 16-86 ZONA 11, COLONIA COLINAS DE MINERVA",22881033,MARIA ISABEL OLIVA NAJERA,EVGENY FRINÉ POLANCO VILLATORO,BASICO,PRIVADO,URBANA,ABIERTA,MONOLINGUE,MATUTINA,DIARIO(REGULAR),GUATEMALA OCCIDENTE
01-08-0544-45,01-409,GUATEMALA,MIXCO,CENTRO INTEGRAL EDUCATIVO SAN FRANCISCO,"0 AVENIDA ""B"" 5-55 ZONA 4 MONSERRAT I",55086336,DELMY CONSUELO GARCIA DONIS DE GOMEZ,VILMA ISABEL ORÓZCO LÓPEZ DE RAMÍREZ,BASICO,PRIVADO,URBANA,ABIERTA,MONOLINGUE,DOBLE,FIN DE SEMANA,GUATEMALA OCCIDENTE
01-08-0547-45,01-609,GUATEMALA,MIXCO,CENTRO DE APRENDIZAJE BILINGUE NO. 1,7A. CALLE 3-96 ZONA 8 BALCONES II SAN CRISTOBAL,25048292,SILVIA HORTENSIA GONZALEZ MARTINEZ,GRYSELDA AGLAE RAMIREZ BARRIENTOS,BASICO,PRIVADO,URBANA,ABIERTA,MONOLINGUE,DOBLE,DIARIO(REGULAR),GUATEMALA OCCIDENTE
01-08-0549-45,01-409,GUATEMALA,MIXCO,CENTRO INTEGRAL EDUCATIVO SAN FRANCISCO,"0 AVENIDA ""B"" 5-55 COLONIA MONTSERRAT I ZONA 4",55086336,DELMY CONSUELO GARCIA DONIS DE GOMEZ,VILMA ISABEL ORÓZCO LÓPEZ DE RAMÍREZ,BASICO,PRIVADO,URBANA,ABIERTA,MONOLINGUE,DOBLE,FIN DE SEMANA,GUATEMALA OCCIDENTE
01-08-0551-45,01-604,GUATEMALA,MIXCO,CENTRO INTEGRAL EDUCATIVO SAN FRANCISCO,"0 AVENIDA ""B"" 5-55 COLONIA MONTSERRAT I ZONA 4",23643638,EMORA EMPERATRIZ CRUZ DE FUENTES,VILMA ISABEL ORÓZCO LÓPEZ DE RAMÍREZ,BASICO,PRIVADO,URBANA,CERRADA TEMPORALMENTE,MONOLINGUE,VESPERTINA,DIARIO(REGULAR),GUATEMALA OCCIDENTE
01-08-0557-45,01-409,GUATEMALA,MIXCO,LICEO CANADIENSE SOCIEDAD ANÓNIMA,30 AVENIDA 5-19 ZONA 4 COLONIA BOSQUES DE SAN NICOLAS,23750075,DELMY CONSUELO GARCIA DONIS DE GOMEZ,LIDIA ANTONIETA GONZÁLEZ ARELLANO,BASICO,PRIVADO,URBANA,ABIERTA,MONOLINGUE,DOBLE,FIN DE SEMANA,GUATEMALA OCCIDENTE
01-08-0565-45,01-639,GUATEMALA,MIXCO,"CENTRO DE EDUCACIÓN EXTRAESCOLAR-CEEX-COOPERATIVA ""EL NARANJITO","42 AVENIDA 8-91, ALDEA EL NARANJITO",53471525,ANDREA VANESSA ALDANA VILLAGRAN DE CASTRO,GRICELDA LÓPEZ YOC DE HERNÁNDEZ,BASICO,PRIVADO,RURAL,CERRADA TEMPORALMENTE,MONOLINGUE,DOBLE,FIN DE SEMANA,GUATEMALA OCCIDENTE
01-08-0571-45,01-601,GUATEMALA,MIXCO,COLEGIO CRISTIANO ESTRELLA DE DAVID,AVENIDA LA BRIGADA 5-33 COLONIA BELEN ZONA 7,53225823,CLAUDIO DANIEL YAC OROZCO,JESSICA IRLENÉ GÓMEZ MENCOS DE CARDENAS,BASICO,PRIVADO,URBANA,ABIERTA,MONOLINGUE,VESPERTINA,DIARIO(REGULAR),GUATEMALA OCCIDENTE
01-08-0573-45,01-603,GUATEMALA,MIXCO,LICEO TECNICO INTERAMERICANO,4A. CALLE 4-39 C ZONA 1,51254491,ROSA ALBELIA ARDON DE MOTTA,ANA LUISA ALVARADO SANCHEZ,BASICO,PRIVADO,URBANA,CERRADA TEMPORALMENTE,MONOLINGUE,DOBLE,FIN DE SEMANA,GUATEMALA OCCIDENTE
01-08-0574-45,01-603,GUATEMALA,MIXCO,LICEO TECNICO INTERAMERICANO,4A. CALLE 4-39 C ZONA 1,51254491,ROSA ALBELIA ARDON DE MOTTA,ANA LUISA ALVARADO SÁNCHEZ,BASICO,PRIVADO,URBANA,CERRADA TEMPORALMENTE,MONOLINGUE,DOBLE,FIN DE SEMANA,GUATEMALA OCCIDENTE
01-08-0577-45,01-603,GUATEMALA,MIXCO,CENTRO EDUCATIVO PAULO NEVES FREIRE,9A. AVENIDA 5-15 ZONA 1,24344227,ROSA ALBELIA ARDON DE MOTTA,LIDIA DUBULIA PATZÁN RAMIREZ,BASICO,PRIVADO,URBANA,ABIERTA,MONOLINGUE,DOBLE,FIN DE SEMANA,GUATEMALA OCCIDENTE
01-08-0578-45,01-603,GUATEMALA,MIXCO,CENTRO EDUCATIVO PAULO NEVES FREIRE,9A. AVENIDA 5-15 ZONA 1,24344227,ROSA ALBELIA ARDON DE MOTTA,LIDIA DUBILIA PATZÁN RAMIREZ,BASICO,PRIVADO,URBANA,ABIERTA,MONOLINGUE,DOBLE,FIN DE SEMANA,GUATEMALA OCCIDENTE
01-08-0595-45,01-603,GUATEMALA,MIXCO,CENTRO EDUCATIVO SANTANDER DE MIXCO,8A. AVENIDA 0-62 ZONA 1,44279767,ROSA ALBELIA ARDON DE MOTTA,JOSÉ DAVID FRANCISCO GARCIA GARMA,BASICO,PRIVADO,URBANA,ABIERTA,MONOLINGUE,DOBLE,FIN DE SEMANA,GUATEMALA OCCIDENTE
01-08-0596-45,01-603,GUATEMALA,MIXCO,CENTRO EDUCATIVO SANTANDER DE MIXCO,8A. AVENIDA 0-62 ZONA 1,44279767,ROSA ALBELIA ARDON DE MOTTA,BLANCA ROSA JIMENEZ OCHOA,BASICO,PRIVADO,URBANA,ABIERTA,MONOLINGUE,DOBLE,FIN DE SEMANA,GUATEMALA OCCIDENTE
01-08-0598-45,01-604,GUATEMALA,MIXCO,CENTRO EDUCATIVO MUNICIPAL,2A. AV. Y 6A. CALLE ZONA 4,23077360,EMORA EMPERATRIZ CRUZ DE FUENTES,YENIFER ALEJANDRA CHUNCHUN MAYEN,BASICO,MUNICIPAL,URBANA,ABIERTA,MONOLINGUE,MATUTINA,DIARIO(REGULAR),GUATEMALA OCCIDENTE
01-08-0602-45,01-603,GUATEMALA,MIXCO,CENTRO EDUCATIVO JUAN PABLO II,FINCA EL SEMINARIO CASA 77 COLONIA PABLO VI ZONA 7,41484090,ROSA ALBELIA ARDON DE MOTTA,LIDIA PATRICIA RODAS FLORES,BASICO,PRIVADO,RURAL,ABIERTA,MONOLINGUE,MATUTINA,DIARIO(REGULAR),GUATEMALA OCCIDENTE
01-08-0604-45,01-621,GUATEMALA,MIXCO,LICEO SANTO DOMINGO,10A. AVENIDA 0-21 ZONA 1,22696797,MARTA LUZ BETETA ORTIZ DE JORDAN,ZOILA AMADILIA GARCIA DE ALONZO,BASICO,PRIVADO,URBANA,ABIERTA,MONOLINGUE,MATUTINA,DIARIO(REGULAR),GUATEMALA OCCIDENTE
01-08-0608-45,01-639,GUATEMALA,MIXCO,"CENTRO DE EDUCACIÓN EXTRAESCOLAR -CEEX- ASOCIACIÓN ""FUTURO PARA TODOS""","7MA AVENIDA D 7-58 SECTOR A10, ALDEA EL CAMPANERO, ZONA8",55498458,ANDREA VANESSA ALDANA VILLAGRAN DE CASTRO,HEIDI BEATRIZ MORALES CHUPINA,BASICO,PRIVADO,RURAL,CERRADA TEMPORALMENTE,MONOLINGUE,DOBLE,FIN DE SEMANA,GUATEMALA OCCIDENTE
01-08-0612-45,01-409,GUATEMALA,MIXCO,COLEGIO MIXTO INFANTE DEL MILAGRO,"SECCIN Q LOTE 146, COLONIA EL MILAGRO ZONA 6",24833588,DELMY CONSUELO GARCIA DONIS DE GOMEZ,SERGIO AMILCAR MORALES ESQUIVEL,BASICO,PRIVADO,URBANA,ABIERTA,MONOLINGUE,DOBLE,FIN DE SEMANA,GUATEMALA OCCIDENTE
01-08-0613-45,01-409,GUATEMALA,MIXCO,COLEGIO MIXTO INFANTE DEL MILAGRO,"SECCIN Q LOTE 146 COLONIA EL MILAGRO, ZONA 6",24833588,DELMY CONSUELO GARCIA DONIS DE GOMEZ,SERGIO AMILCAR MORALES ESQUIVEL,BASICO,PRIVADO,URBANA,ABIERTA,MONOLINGUE,DOBLE,FIN DE SEMANA,GUATEMALA OCCIDENTE
01-08-0617-45,01-604,GUATEMALA,MIXCO,CENTRO INTEGRAL EDUCATIVO SAN FRANCISCO,"0 AVENIDA ""B"" 5-55 ZONA 4 MONSERRAT 1",23643638,EMORA EMPERATRIZ CRUZ DE FUENTES,VILMA ISABEL OROZCO LÓPEZ,BASICO,PRIVADO,URBANA,ABIERTA,MONOLINGUE,MATUTINA,DIARIO(REGULAR),GUATEMALA OCCIDENTE
01-08-0623-45,01-604,GUATEMALA,MIXCO,CENTRO EDUCATIVO APOYATE EN MÍ,BOULEVARD EL NARANJO 29-40 ZONA 4,24360885,EMORA EMPERATRIZ CRUZ DE FUENTES,SILVIA ROSSANA GONZÁLEZ CARDONA DE ESTRADA,BASICO,PRIVADO,URBANA,ABIERTA,MONOLINGUE,MATUTINA,DIARIO(REGULAR),GUATEMALA OCCIDENTE
01-08-0626-45,01-409,GUATEMALA,MIXCO,CENTRO EDUCATIVO APÓYATE EN MÍ,BOULEVARD EL NARANJO 29-40 ZONA 4,24360885,DELMY CONSUELO GARCIA DONIS DE GOMEZ,SILVIA ROSSANA GONZÁLEZ CARDONA,BASICO,PRIVADO,URBANA,ABIERTA,MONOLINGUE,DOBLE,FIN DE SEMANA,GUATEMALA OCCIDENTE
01-08-0627-45,01-621,GUATEMALA,MIXCO,COORDINACION DEPARTAMENTAL DE TELESECUNDARIA DE GUATEMALA OCCIDENTE,"4A. AVENIDAD ""B"" 0-69 ZONA 2 COLONIA COTIO",22502206,MARTA LUZ BETETA ORTIZ DE JORDAN,MILVIA LUCRECIA ORELLANA Y ORELLANA,BASICO,OFICIAL,URBANA,TEMPORAL NOMBRAMIENTO,MONOLINGUE,VESPERTINA,DIARIO(REGULAR),GUATEMALA OCCIDENTE
01-08-0628-45,01-615,GUATEMALA,MIXCO,"LICEO MIXTO VALLE INTEGRADO ""LIMVI""",BLVD. SACOJ GRANDE 83-24 Z. 6 ALDEA SACOJ GRANDE,53028921,LILIANA MARINA FLORES JIMENEZ,MARÍA ALEJANDRA ALQUIJAY PIRIR,BASICO,PRIVADO,URBANA,ABIERTA,MONOLINGUE,MATUTINA,DIARIO(REGULAR),GUATEMALA OCCIDENTE
01-08-0631-45,01-608,GUATEMALA,MIXCO,"CENTRO EDUCATIVO ""FE Y ARMONÍA""",22 CA. 12-30 ZONA 10 MIXCO LAS MARAVILLAS (SAN JOSE LA COMUNIDAD),33636352,EDGAR ALBERTO SIMON CHALI,DELMI AMARILIS ANGEL CORTEZ,BASICO,PRIVADO,URBANA,CERRADA TEMPORALMENTE,MONOLINGUE,VESPERTINA,DIARIO(REGULAR),GUATEMALA OCCIDENTE
01-08-0632-45,01-409,GUATEMALA,MIXCO,"CENTRO EDUCATIVO ""FE Y ARMONÍA""",22 CA. 12-30 ZONA 10 MIXCO LAS MARAVILLAS (SAN JOSE LA COMUNIDAD),33636352,DELMY CONSUELO GARCIA DONIS DE GOMEZ,DELMI AMARILIS ANGEL CORTEZ,BASICO,PRIVADO,URBANA,ABIERTA,MONOLINGUE,DOBLE,FIN DE SEMANA,GUATEMALA OCCIDENTE
01-08-0633-45,01-409,GUATEMALA,MIXCO,"CENTRO EDUCATIVO ""FE Y ARMONÍA""",22 CA. 12-30 ZONA 10 MIXCO LAS MARAVILLAS (SAN JOSE LA COMUNIDAD),33636352,DELMY CONSUELO GARCIA DONIS DE GOMEZ,DELMI AMARILIS ANGEL CORTEZ,BASICO,PRIVADO,URBANA,ABIERTA,MONOLINGUE,DOBLE,FIN DE SEMANA,GUATEMALA OCCIDENTE
01-08-0641-45,01-616,GUATEMALA,MIXCO,COLEGIO INTERECO,14 CALLE O BULEVAR ALAMEDAS 36-51 ZONA 6 ALAMEDAS DE YUMAR,24384131,RENE SAZO NAVICHOQUE,MARLYN BEATRIZ NORIEGA OVALLE,BASICO,PRIVADO,URBANA,ABIERTA,MONOLINGUE,MATUTINA,DIARIO(REGULAR),GUATEMALA OCCIDENTE
01-08-0644-45,01-604,GUATEMALA,MIXCO,"CENTRO EDUCATIVO MUNICIPAL ""CEM""",2A. AVENIDA Y 6A. CALLE ZONA 4,23077360,EMORA EMPERATRIZ CRUZ DE FUENTES,MARIA ESTHER VÁSQUEZ GOUBAUD,BASICO,MUNICIPAL,URBANA,ABIERTA,MONOLINGUE,VESPERTINA,DIARIO(REGULAR),GUATEMALA OCCIDENTE
01-08-0647-45,01-409,GUATEMALA,MIXCO,CENTRO EDUCATIVO HOSANNA,"6A. AVENIDA 22-44, SECTOR 2, SAN JOSE LA COMUNIDAD ZONA 10",24338676,DELMY CONSUELO GARCIA DONIS DE GOMEZ,JOEL MIZRAIM CANO TORRES,BASICO,PRIVADO,URBANA,ABIERTA,MONOLINGUE,DOBLE,FIN DE SEMANA,GUATEMALA OCCIDENTE
01-08-0649-45,01-602,GUATEMALA,MIXCO,COLEGIO MIXTO VISTA AL VALLE,18 CA. 0-40 Z. 1 COLONIA VISTA AL VALLE (LO DE COY),56047876,FAJARDO LOPEZ MARTINEZ,KELI CAROLINA BOROR GARCÍA,BASICO,PRIVADO,URBANA,ABIERTA,MONOLINGUE,VESPERTINA,DIARIO(REGULAR),GUATEMALA OCCIDENTE
01-08-0650-45,01-639,GUATEMALA,MIXCO,COLEGIO TÉCNICO EN INFORMÁTICA,"9A. CALLE A 0-52 COLONIA MONTSERRAT 1, ZONA 4",24370378,ANDREA VANESSA ALDANA VILLAGRAN DE CASTRO,CELESTINO MIGUEL TEMAJ PABLO,BASICO,PRIVADO,URBANA,ABIERTA,MONOLINGUE,DOBLE,A DISTANCIA,GUATEMALA OCCIDENTE
01-08-0654-45,01-609,GUATEMALA,MIXCO,COLEGIO PESTALOZZI,"BOULEVARD PRINCIPAL, CIUDAD DE SAN CRISTOBAL 3ERA CALLE 8-49 SECTOR A 1 ZONA 8",24432520,SILVIA HORTENSIA GONZALEZ MARTINEZ,ADA MAGALY GÓMEZ MÉRIDA,BASICO,PRIVADO,URBANA,ABIERTA,MONOLINGUE,MATUTINA,DIARIO(REGULAR),GUATEMALA OCCIDENTE
01-08-0657-45,01-639,GUATEMALA,MIXCO,LICEO TÉCNICO INTERAMERICANO,4A. CALLE 4-39 C ZONA 1,24335021,ANDREA VANESSA ALDANA VILLAGRAN DE CASTRO,ANA LUISA ALVARADO SÁNCHEZ DE LAJUJ,BASICO,PRIVADO,URBANA,CERRADA TEMPORALMENTE,MONOLINGUE,DOBLE,A DISTANCIA,GUATEMALA OCCIDENTE
01-08-0658-45,01-639,GUATEMALA,MIXCO,LICEO TÉCNICO INTERAMERICANO,4A. CALLE 4-39 C ZONA 1,24335021,ANDREA VANESSA ALDANA VILLAGRAN DE CASTRO,ANA LUISA ALVARADO SÁNCHEZ DE LAJUJ,BASICO,PRIVADO,URBANA,CERRADA TEMPORALMENTE,MONOLINGUE,DOBLE,A DISTANCIA,GUATEMALA OCCIDENTE
01-08-0661-45,01-606,GUATEMALA,MIXCO,"LICEO MIXTO ""EMANUEL""","12A. AVENIDA ""A"" 0-80 COL. LO DE FUENTES ZONA 11 02/01/2020",23083871,MARIA ISABEL OLIVA NAJERA,IRMA YOLANDA CORADO ALMIREZ,BASICO,PRIVADO,URBANA,ABIERTA,MONOLINGUE,MATUTINA,DIARIO(REGULAR),GUATEMALA OCCIDENTE
01-08-0666-45,01-608,GUATEMALA,MIXCO,COLEGIO MIXTO JUVENTUD SAN FRANCISCO,3 CA. A 1-41 Z. 10 MIXCO COLONIA LOMAS DE SAN JACINTO,24335599,EDGAR ALBERTO SIMON CHALI,DALMA YOLANDA VEGA ALEMÁN DE DÍAZ,BASICO,PRIVADO,URBANA,CERRADA TEMPORALMENTE,MONOLINGUE,VESPERTINA,DIARIO(REGULAR),GUATEMALA OCCIDENTE
01-08-0667-45,01-601,GUATEMALA,MIXCO,CENTRO EDUCATIVO EDUNIÑOS,3ERA. CALLE 2-12 COLONIA JARDINES DE SAN JUAN ZONA 7,50168233,CLAUDIO DANIEL YAC OROZCO,ROSA MARÍA CASTAÑEDA GUTIÉRREZ,BASICO,PRIVADO,URBANA,ABIERTA,MONOLINGUE,MATUTINA,DIARIO(REGULAR),GUATEMALA OCCIDENTE
01-08-0679-45,01-608,GUATEMALA,MIXCO,COLEGIO LOMAS DSJ,2A. CALLE 2-02 COLONIA LOMAS DE SAN JACINTO ZONA 10,24350959,EDGAR ALBERTO SIMON CHALI,ROSA MARIELA BORRAYO GUTIERREZ DE BATRES,BASICO,PRIVADO,URBANA,ABIERTA,MONOLINGUE,MATUTINA,DIARIO(REGULAR),GUATEMALA OCCIDENTE
01-08-0683-45,01-604,GUATEMALA,MIXCO,"COLEGIO SAN ANTONIO DE PADUA ""PROTECTOR DE LA JUVENTUD""",5A. AVENIDA 7-55 ZONA 4 DE MIXCO MONTSERRAT II,41377224,EMORA EMPERATRIZ CRUZ DE FUENTES,OSCAR INOCENTE PEREZ FELIPE,BASICO,PRIVADO,URBANA,ABIERTA,MONOLINGUE,MATUTINA,DIARIO(REGULAR),GUATEMALA OCCIDENTE
01-08-0689-45,01-609,GUATEMALA,MIXCO,COLEGIO KABOOM,BOULEVARD SUR 5-97 SECTOR D-1 COLONIA PANORAMA DE SAN CRISTOBAL ZONA 8,24795330,SILVIA HORTENSIA GONZALEZ MARTINEZ,MILDRE JOHANA ARANA,BASICO,PRIVADO,URBANA,ABIERTA,MONOLINGUE,MATUTINA,DIARIO(REGULAR),GUATEMALA OCCIDENTE
01-08-0690-45,01-639,GUATEMALA,MIXCO,CENTRO DE EDUCACIÓN A DISTANCIA ESCOLARIS,"KM. 19.5 CARRETERA ROOSEVELT 7-55, LO DE COY ZONA 1",23271111,ANDREA VANESSA ALDANA VILLAGRAN DE CASTRO,WHENDOLYN BETSABE ESTRADA CANIZALES,BASICO,PRIVADO,URBANA,ABIERTA,MONOLINGUE,DOBLE,A DISTANCIA,GUATEMALA OCCIDENTE
01-08-0691-45,01-615,GUATEMALA,MIXCO,CENTRO EDUCATIVO VILLA EDUCACIÓN,13 AVENIDA 8-51 COLONIA VILLA FLOR ZONA 6,23330353,LILIANA MARINA FLORES JIMENEZ,LILIAN RUTH CRUZ MORALES,BASICO,PRIVADO,URBANA,ABIERTA,MONOLINGUE,VESPERTINA,DIARIO(REGULAR),GUATEMALA OCCIDENTE
01-08-0697-45,01-639,GUATEMALA,MIXCO,CENTRO EDUCATIVO HANDS AT WORK HOMESCHOOL,"KILOMETRO 18, CALZADA ROOSEVELT 13-35 ZONA 1",54851328,ANDREA VANESSA ALDANA VILLAGRAN DE CASTRO,MARLEN MAGALI CERÓN MARROQUÍN,BASICO,PRIVADO,URBANA,ABIERTA,MONOLINGUE,DOBLE,SEMIPRESENCIAL,GUATEMALA OCCIDENTE
01-08-0698-45,01-603,GUATEMALA,MIXCO,"CENTRO TÉCNICO VOCACIONAL ""WILLIAM CORNELIUS""",9A. CALLE 14-55 ZONA 3 COLONIA LOMAS DE COTIO,24315158,ROSA ALBELIA ARDON DE MOTTA,MARTHA LISSET GIRÓN KRISCHE DE ORELANA,BASICO,PRIVADO,URBANA,ABIERTA,MONOLINGUE,MATUTINA,DIARIO(REGULAR),GUATEMALA OCCIDENTE
01-08-0705-45,01-602,GUATEMALA,MIXCO,LICEO CRISTIANO FORTALEZA,4A. AVENIDA 2-70 COLONIA CIUDAD SATÉLITE ZONA 9,53254810,FAJARDO LOPEZ MARTINEZ,ELVIA AMARILIS PINEDA ESCOBAR,BASICO,PRIVADO,URBANA,ABIERTA,MONOLINGUE,MATUTINA,DIARIO(REGULAR),GUATEMALA OCCIDENTE
01-08-0708-45,01-639,GUATEMALA,MIXCO,CENTRO DE EDUCACIÓN A DISTANCIA ESCOLARIS,"KM. 19.5 CARRETERA ROOSEVELT 7-55, ZONA 1. LO DE COY",23271111,ANDREA VANESSA ALDANA VILLAGRAN DE CASTRO,WHENDOLYN BETSABE ESTRADA CANIZALES,BASICO,PRIVADO,URBANA,ABIERTA,MONOLINGUE,DOBLE,A DISTANCIA,GUATEMALA OCCIDENTE
01-08-0713-45,01-621,GUATEMALA,MIXCO,LICEO DEL BOSQUE,"4TA. CALLE 4-39 ""C"" ZONA 1",24344946,MARTA LUZ BETETA ORTIZ DE JORDAN,ANA LUISA ALVARADO SÁNCHEZ,BASICO,PRIVADO,URBANA,ABIERTA,MONOLINGUE,MATUTINA,DIARIO(REGULAR),GUATEMALA OCCIDENTE
01-08-0717-45,01-639,GUATEMALA,MIXCO,COLEGIO NAKBÉ,14 AVENIDA 0-81 B ZONA 2 URBANIZACION GONZALEZ,22323194,ANDREA VANESSA ALDANA VILLAGRAN DE CASTRO,KARLA NOEMÍ ALVAREZ FLORES,BASICO,PRIVADO,URBANA,ABIERTA,MONOLINGUE,DOBLE,SEMIPRESENCIAL,GUATEMALA OCCIDENTE
01-08-0718-45,01-639,GUATEMALA,MIXCO,COLEGIO NAKBÉ,14 AVENIDA 0-81 B ZONA 2 URBANIZACIN GONZALEZ,22323194,ANDREA VANESSA ALDANA VILLAGRAN DE CASTRO,KARLA NOEMÍ ALVAREZ FLORES,BASICO,PRIVADO,URBANA,ABIERTA,MONOLINGUE,DOBLE,SEMIPRESENCIAL,GUATEMALA OCCIDENTE
01-08-0721-45,01-639,GUATEMALA,MIXCO,COLEGIO GUATEMALTECO EDU,8A. AVENIDA 8-05 ZONA 1,57556885,ANDREA VANESSA ALDANA VILLAGRAN DE CASTRO,VERONICA UBEDO CARRILLO,BASICO,PRIVADO,URBANA,ABIERTA,MONOLINGUE,DOBLE,SEMIPRESENCIAL,GUATEMALA OCCIDENTE
01-08-0725-45,01-608,GUATEMALA,MIXCO,"""COLEGIO PREPARATORIA UNIFICADA""",7A. AVENIDA 20-34 ZONA10,43432006,EDGAR ALBERTO SIMON CHALI,EVA MARROQUÍN COY DE LÓPEZ,BASICO,PRIVADO,URBANA,ABIERTA,MONOLINGUE,VESPERTINA,DIARIO(REGULAR),GUATEMALA OCCIDENTE
01-08-0848-45,01-608,GUATEMALA,MIXCO,IPMB CENTRO EDUCATIVO CRISTIANO 'JERUSALEM',4A AVE. 'B' 0-69 COLONIA COTIO ZONA 2,24355182,EDGAR ALBERTO SIMON CHALI,,BASICO,PRIVADO,URBANA,CERRADA TEMPORALMENTE,MONOLINGUE,MATUTINA,DIARIO(REGULAR),GUATEMALA OCCIDENTE
01-08-1686-45,01-401,GUATEMALA,MIXCO,INEBE CON ORIENTACIÓN OCUPACIONAL LICENCIADA MARÍA MAGDALENA PONCE DE VELIZ,"10A. AVENIDA 9-04, COLONIA NUEVA MONTSERRAT ZONA 3",24332716,IXMUCANE ALDANA VILLAVICENCIO,GEOVANA FRINNÉ SAMAYOA PRADO,BASICO,OFICIAL,URBANA,ABIERTA,MONOLINGUE,MATUTINA,DIARIO(REGULAR),GUATEMALA OCCIDENTE
01-08-1687-45,01-616,GUATEMALA,MIXCO,INEB EXPERIMENTAL CON ORIENT. OCUPACIONAL PROFESOR. ROBERTO ANTONIO VILLEDA SANTIS,13 AVENIDA 16-42 ZONA 6 COLONIA SAN JOSE LAS ROSAS,24352082,RENE SAZO NAVICHOQUE,,BASICO,OFICIAL,URBANA,ABIERTA,MONOLINGUE,MATUTINA,DIARIO(REGULAR),GUATEMALA OCCIDENTE
01-08-1688-45,01-607,GUATEMALA,MIXCO,INEB EXPERIMENTAL CON ORIENT. OCUPACIONAL SIMON BOLIVAR,8A AVE. 18-58 COLONIA 1RO DE JULIO ZONA 5,24337230,OLGA MARINA AJQUEJAY SALOJ DE TUBAC,EMILIO RAFAEL MIRANDA LOPEZ,BASICO,OFICIAL,URBANA,ABIERTA,MONOLINGUE,MATUTINA,DIARIO(REGULAR),GUATEMALA OCCIDENTE
01-08-1689-45,01-601,GUATEMALA,MIXCO,INEB 'LIC. CLEMENTE MARROQUIN ROJAS',"16 CALLE 10-39 COL. SAN IGNACIO, MIXCO",24362418,CLAUDIO DANIEL YAC OROZCO,,BASICO,OFICIAL,URBANA,ABIERTA,MONOLINGUE,VESPERTINA,DIARIO(REGULAR),GUATEMALA OCCIDENTE
01-08-1690-45,01-615,GUATEMALA,MIXCO,INEB COLONIA CAROLINGIA,BOULEVARD EL CAMINERO 27-33 ZONA 6,59479242,LILIANA MARINA FLORES JIMENEZ,ERICK JAVIER VALENZUELA MÉNDEZ,BASICO,OFICIAL,URBANA,ABIERTA,MONOLINGUE,VESPERTINA,DIARIO(REGULAR),GUATEMALA OCCIDENTE
01-08-1691-45,01-607,GUATEMALA,MIXCO,INEB 'COLONIA 1RO DE JULIO ',8A AVE. 18-58 COLONIA 1RO. DE JULIO ZONA 5,24358759,OLGA MARINA AJQUEJAY SALOJ DE TUBAC,,BASICO,OFICIAL,URBANA,ABIERTA,MONOLINGUE,VESPERTINA,DIARIO(REGULAR),GUATEMALA OCCIDENTE
