CODIGO,DISTRITO,DEPARTAMENTO,MUNICIPIO,ESTABLECIMIENTO,DIRECCION,TELEFONO,SUPERVISOR,DIRECTOR,NIVEL,SECTOR,AREA,STATUS,MODALIDAD,JORNADA,PLAN,DEPARTAMENTAL
01-01-0003-45,01-110,GUATEMALA,GUATEMALA,LICEO CIENTIFICO CUMORAH,LOTE 572 MANZANA 5 COLONIA MAYA ZONA 18,22604386,ZUHILEM YESENIA ESTRADA ORTIZ,INGRID ABIGAIL SANABRIA BONILLA,BASICO,PRIVADO,URBANA,CERRADA TEMPORALMENTE,MONOLINGUE,MATUTINA,DIARIO(REGULAR),GUATEMALA NORTE
01-01-0017-45,01-318,GUATEMALA,GUATEMALA,LICEO ROMANO AMERICANO,6A. CALLE 2-12 ZONA 1,22533522,LESLIE AZUCENA MONZON TECUN,LETICIA YANETH BERGANZA BETANCOURTH DE CASTILLO,BASICO,PRIVADO,URBANA,ABIERTA,MONOLINGUE,MATUTINA,DIARIO(REGULAR),GUATEMALA NORTE
01-01-0020-45,01-627,GUATEMALA,GUATEMALA,LICEO ROMANO AMERICANO,6A. CALLE 2-12 ZONA 1,22533522,ISAURA AMPARO RECINOS CARRILLO,VICTOR AMNUEL PORTILLO LEON,BASICO,PRIVADO,URBANA,ABIERTA,MONOLINGUE,DOBLE,FIN DE SEMANA,GUATEMALA NORTE
01-01-0021-45,01-627,GUATEMALA,GUATEMALA,LICEO ROMANO AMERICANO,6A. CALLE 2-12 ZONA 1,22533522,ISAURA AMPARO RECINOS CARRILLO,VICTOR MANUEL PORTILLO LEON,BASICO,PRIVADO,URBANA,ABIERTA,MONOLINGUE,DOBLE,FIN DE SEMANA,GUATEMALA NORTE
01-01-1247-45,01-105,GUATEMALA,GUATEMALA,IEBC DE ENSEÑANZA,"LOTE 8, MANZANA 53 CANTON CENTRAL CANALITOS, ZONA 17",,SANTOS VICTORINO VASQUEZ PAXTOR,,BASICO,COOPERATIVA,RURAL,ABIERTA,MONOLINGUE,VESPERTINA,DIARIO(REGULAR),GUATEMALA NORTE
01-01-2331-45,01-635,GUATEMALA,GUATEMALA,INSTITUTO PRIVADO MIXTO DE EDUCACION BASICA JUAN MARCOS,1A. AVENIDA Y 1A. CALLE ZONA 21 LOMA BLANCA COLONIA GUAJITOS,24494835,JULIO PEREZ GUTIERREZ,,BASICO,PRIVADO,RURAL,ABIERTA,MONOLINGUE,VESPERTINA,DIARIO(REGULAR),GUATEMALA NORTE
01-01-2603-45,01-106,GUATEMALA,GUATEMALA,COLEGIO MIXTO 'JUVENTUD ACTIVA',KM 15 RUTA AL ATLANTICO COLONIA SAN PASCUAL II LOTE 6 Y 12 ZONA 18,22554550,CESAR ARNOLDO MARTINEZ GARCIA,,BASICO,PRIVADO,RURAL,CERRADA TEMPORALMENTE,MONOLINGUE,VESPERTINA,DIARIO(REGULAR),GUATEMALA NORTE
01-01-2814-45,01-211,GUATEMALA,GUATEMALA,COLEGIO EVANGELICO MIXTO EBEN-EZER,CALZADA JUSTO RUFINO BARRIOS 4-21 GUAJITOS ZONA12,24795027,CARLOS ALBERTO ALTAN ORELLANA,,BASICO,PRIVADO,URBANA,ABIERTA,MONOLINGUE,MATUTINA,DIARIO(REGULAR),GUATEMALA NORTE
01-01-2907-45,01-105,GUATEMALA,GUATEMALA,LICEO LOMAS DEL NORTE,"LOTE 13 MANZANA 57, CANALITOS ZONA 17",54647521,SANTOS VICTORINO VASQUEZ PAXTOR,,BASICO,PRIVADO,URBANA,ABIERTA,MONOLINGUE,VESPERTINA,DIARIO(REGULAR),GUATEMALA NORTE
01-01-7602-45,01-106,GUATEMALA,GUATEMALA,INEB DE TELESECUNDARIA,ALDEA LA CEBADILLA ZONA 17,41958053,CESAR ARNOLDO MARTINEZ GARCIA,,BASICO,OFICIAL,RURAL,CERRADA TEMPORALMENTE,MONOLINGUE,VESPERTINA,DIARIO(REGULAR),GUATEMALA NORTE
01-02-0003-45,01-510,GUATEMALA,SANTA CATARINA PINULA,CENTRO EDUCATIVO CRISTIANO KAIROS,"2A. CALLE 2-17, SECTOR II, ZONA 3, ALDEA EL PUEBLITO",23660150,ZOILA ESPERANZA CAMEY ATZ,JOSE ADRIAN MORALES ORTIZ,BASICO,PRIVADO,RURAL,ABIERTA,MONOLINGUE,VESPERTINA,DIARIO(REGULAR),GUATEMALA ORIENTE
01-02-0006-45,01-502,GUATEMALA,SANTA CATARINA PINULA,COLEGIO KING DAVID,"KM. 18.5 CARRETERA A EL SALVADOR, ALDEA EL CANCHON LA LABOR DE MONZON, L. 3, Z. 8.",66611170,JULIA ENECON ROCA MORAN,MAINOR SANMY CASTRO CHUN,BASICO,PRIVADO,URBANA,ABIERTA,MONOLINGUE,MATUTINA,DIARIO(REGULAR),GUATEMALA ORIENTE
01-02-0009-45,01-502,GUATEMALA,SANTA CATARINA PINULA,"COLEGIO ""COUNTRY DAY SCHOOL""",KILOMETRO 18.5 CARRETERA EL SALVADOR ZONA 8 ALDEA EL CANCHON,66859300,JULIA ENECON ROCA MORAN,MAVELIN DINORA GARCÍA BARRERA DE MORENO,BASICO,PRIVADO,RURAL,ABIERTA,MONOLINGUE,MATUTINA,DIARIO(REGULAR),GUATEMALA ORIENTE
01-02-0018-45,01-502,GUATEMALA,SANTA CATARINA PINULA,"COLEGIO ""EL DERECHO AL APRENDIZAJE""","LOTE 10 MANZANA K, SECTOR 1 COLONIA SANTO DOMINGO, PIEDRA PARADA",,JULIA ENECON ROCA MORAN,ROSAURA DOMINGUEZ BRAN,BASICO,PRIVADO,RURAL,CERRADA TEMPORALMENTE,MONOLINGUE,VESPERTINA,DIARIO(REGULAR),GUATEMALA ORIENTE
01-02-0019-45,01-645,GUATEMALA,SANTA CATARINA PINULA,"INSTITUTO DE EDUCACION BASICA POR COOPERATIVA DE ENSEÑANZA ""AGUSTIN UBIETO""","AVENIDA PRINCIPAL FINAL DE ALDEA EL PUEBLITO, SECTOR II ZONA 1",23677819,ALBA MARICELA JOR PORTILLO,PAULINO SOLORZANO MUÑOZ,BASICO,COOPERATIVA,RURAL,ABIERTA,MONOLINGUE,VESPERTINA,DIARIO(REGULAR),GUATEMALA ORIENTE
01-02-0020-45,01-644,GUATEMALA,SANTA CATARINA PINULA,INEB,ALDEA PIEDRA PARADA CRISTO REY,59222707,LIGIA DEL ROSARIO RICCI VELASQUEZ,---,BASICO,OFICIAL,RURAL,ABIERTA,MONOLINGUE,VESPERTINA,DIARIO(REGULAR),GUATEMALA ORIENTE
01-02-0021-45,01-502,GUATEMALA,SANTA CATARINA PINULA,INEB,ALDEA EL PAJON,30526535,JULIA ENECON ROCA MORAN,---,BASICO,OFICIAL,RURAL,ABIERTA,MONOLINGUE,VESPERTINA,DIARIO(REGULAR),GUATEMALA ORIENTE
01-02-0028-45,01-644,GUATEMALA,SANTA CATARINA PINULA,INEB DE TELESECUNDARIA,ALDEA SAN JOSE EL MANZANO,55265927,LIGIA DEL ROSARIO RICCI VELASQUEZ,ERICKA NOHEMÍ PÉREZ RAFAÉL CALDERÓN,BASICO,OFICIAL,RURAL,ABIERTA,MONOLINGUE,VESPERTINA,DIARIO(REGULAR),GUATEMALA ORIENTE
01-02-0033-45,01-502,GUATEMALA,SANTA CATARINA PINULA,COLEGIO BILINGUE INTEGRIDAD (INTEGRITY),"ALDEA DON JUSTO KILOMETRO 16.5 CARRETERA A SAN JOSE PINULA, CASERIO LA LAGUNETA,",66371400,JULIA ENECON ROCA MORAN,MARIA DEL CARMEN BARRERA ARAGON DE DAVILA,BASICO,PRIVADO,RURAL,ABIERTA,MONOLINGUE,MATUTINA,DIARIO(REGULAR),GUATEMALA ORIENTE
01-02-0035-45,01-502,GUATEMALA,SANTA CATARINA PINULA,LICEO INTEGRAL DE ENSEÑANZA COMERCIAL -LIEC-,"SECTOR LOS TRES REYES, LOTE 5""E"" ZONA 7 ALDEA EL PAJÓN",66373741,JULIA ENECON ROCA MORAN,JOSE ADOLFO ESPINOZA MORATAYA,BASICO,PRIVADO,RURAL,ABIERTA,MONOLINGUE,MATUTINA,DIARIO(REGULAR),GUATEMALA ORIENTE
01-02-0042-45,01-502,GUATEMALA,SANTA CATARINA PINULA,COLEGIO VALLE VERDE CES,"KILOMETRO 17.5 CARRETERA A EL SALVADOR, FINCA LA ESPERANZA, LOTE 1 ZONA 8",66242280,JULIA ENECON ROCA MORAN,ALINA MARÍA SCHNEIDER MONSANTO DE CASADO,BASICO,PRIVADO,RURAL,ABIERTA,MONOLINGUE,MATUTINA,DIARIO(REGULAR),GUATEMALA ORIENTE
01-02-0047-45,01-644,GUATEMALA,SANTA CATARINA PINULA,COLEGIO TECNOLOGICO SINAI,"LOTE 88 ""A"" ZONA 6 ALDEA PIEDRA PARADA CRISTO REY",53859465,LIGIA DEL ROSARIO RICCI VELASQUEZ,RONAL ALEXANDER BARRIOS PAZ,BASICO,PRIVADO,RURAL,ABIERTA,MONOLINGUE,VESPERTINA,DIARIO(REGULAR),GUATEMALA ORIENTE
01-02-0054-45,01-510,GUATEMALA,SANTA CATARINA PINULA,COLEGIO MADRE DEL DIVINO PASTOR,3RA CALLE 7-75 ZONA 01,23660365,ZOILA ESPERANZA CAMEY ATZ,TERESITA NUÑEZ GOMEZ,BASICO,PRIVADO,URBANA,ABIERTA,MONOLINGUE,MATUTINA,DIARIO(REGULAR),GUATEMALA ORIENTE
01-02-0057-45,01-405,GUATEMALA,SANTA CATARINA PINULA,"INSTITUTO OFICIAL DE EDUCACIÒN BASICA Y BACHILLERATO POR MADUREZ "" LICENCIADA MIRMA FIGUEROA DE CORO """,LOTE 45 ALDEA EL PAJON,59237443,BLANCA SARAI GUTIERREZ PINEDA,MA. Y LIC. JOSE ADOLFO ESPINOZA MORATAYA,BASICO,MUNICIPAL,RURAL,ABIERTA,MONOLINGUE,DOBLE,FIN DE SEMANA,GUATEMALA ORIENTE
01-02-0059-45,01-405,GUATEMALA,SANTA CATARINA PINULA,"INSTITUTO OFICIAL DE EDUCACIÒN BÁSICA Y BACHILLERTO POR MADUREZ, SUBSIDIADO POR LA MUNICIPALIDAD DE SANTA CATARINA PINULA",6A. AVENIDA 1-10 ZONA 1,52042077,BLANCA SARAI GUTIERREZ PINEDA,PEM. CALIXTO HIPOLITO BAMACA MENDEZ,BASICO,MUNICIPAL,URBANA,ABIERTA,MONOLINGUE,DOBLE,FIN DE SEMANA,GUATEMALA ORIENTE
01-02-0063-45,01-644,GUATEMALA,SANTA CATARINA PINULA,COLEGIO TECNOLÓGICO SINAÍ,"ALDEA PIEDRA PARADA CRISTO REY, CALLE PRINCIPAL LOTE 88 ""A"" ZONA 6",66455922,LIGIA DEL ROSARIO RICCI VELASQUEZ,RONAL ALEXANDER BARRIOS PAZ,BASICO,PRIVADO,RURAL,ABIERTA,MONOLINGUE,MATUTINA,DIARIO(REGULAR),GUATEMALA ORIENTE
01-02-0067-45,01-502,GUATEMALA,SANTA CATARINA PINULA,COLEGIO THE ORCHARD CARE,"KM. 18.5 CARRETERA A EL SALVADOR, HACIENDA MIRAGE, CASA NO. 1 ZONA 8",66342154,JULIA ENECON ROCA MORAN,SILVIA EUGENIA CASTRO CASTILLO DE ARRIAZA,BASICO,PRIVADO,RURAL,ABIERTA,MONOLINGUE,MATUTINA,DIARIO(REGULAR),GUATEMALA ORIENTE
01-02-0075-45,01-502,GUATEMALA,SANTA CATARINA PINULA,COLEGIO LA PLACE,LOTE # 23 SAN GABRIEL; KM. 18 CARRETERA A EL SALVADOR GUATEMALA,66346612,JULIA ENECON ROCA MORAN,MARCO ANTONIO CASTAÑEDA FLORES,BASICO,PRIVADO,URBANA,ABIERTA,MONOLINGUE,INTERMEDIA,A DISTANCIA,GUATEMALA ORIENTE
01-02-0077-45,01-502,GUATEMALA,SANTA CATARINA PINULA,COLEGIO LA PLACE,"LOTE # 23 SAN GABRIEL, KM. 18 CARRETERA A EL SALVADOR GUATEMALA",66346612,JULIA ENECON ROCA MORAN,PEM .F/M. MARCO ANTONIO CASTAÑEDA FLORES,BASICO,PRIVADO,URBANA,ABIERTA,MONOLINGUE,INTERMEDIA,A DISTANCIA,GUATEMALA ORIENTE
01-02-1275-45,01-645,GUATEMALA,SANTA CATARINA PINULA,INSTITUTO DE EDUCACION BASICA POR COOPERATIVA DE ENSEÑANZA,"6A AVENIDA, 1-10 ZONA 1",23686089,ALBA MARICELA JOR PORTILLO,HUGO VALDEMAR CIFUENTES SALGUERO,BASICO,COOPERATIVA,URBANA,ABIERTA,MONOLINGUE,NOCTURNA,DIARIO(REGULAR),GUATEMALA ORIENTE
01-02-1276-45,01-645,GUATEMALA,SANTA CATARINA PINULA,INSTITUTO DE EDUCACION BASICA POR COOPERATIVA DE ENSEÑANZA,KILOMETRO 16.5 CARRETERA A EL SALVADOR ALDEA DON JUSTO,66347449,ALBA MARICELA JOR PORTILLO,,BASICO,COOPERATIVA,RURAL,ABIERTA,MONOLINGUE,VESPERTINA,DIARIO(REGULAR),GUATEMALA ORIENTE
01-02-2407-45,01-502,GUATEMALA,SANTA CATARINA PINULA,INSTITUTO PARTICULAR MIXTO DE EDUCACION BASICA SAN FRANCISCO DE ASIS,ALDEA EL PAJON,66373340,JULIA ENECON ROCA MORAN,,BASICO,PRIVADO,RURAL,ABIERTA,MONOLINGUE,VESPERTINA,DIARIO(REGULAR),GUATEMALA ORIENTE
01-02-2522-45,01-644,GUATEMALA,SANTA CATARINA PINULA,INSTITUTO PRIVADO MIXTO DE EDUCACION BASICA COLEGIO INTERNACIONAL MONTESSORI,"KM. 13.5 CARRETERA A EL SALVADOR FINCA LA LUZ, PUERTA PARADA",66281200,LIGIA DEL ROSARIO RICCI VELASQUEZ,,BASICO,PRIVADO,RURAL,ABIERTA,MONOLINGUE,MATUTINA,DIARIO(REGULAR),GUATEMALA ORIENTE
01-02-2610-45,01-645,GUATEMALA,SANTA CATARINA PINULA,INSTITUTO DE EDUCACION BASICA POR COOPERATIVA DE ENSEÑANZA,PIEDRA PARADA EL ROSARIO,30434918,ALBA MARICELA JOR PORTILLO,,BASICO,COOPERATIVA,RURAL,ABIERTA,MONOLINGUE,VESPERTINA,DIARIO(REGULAR),GUATEMALA ORIENTE
01-02-2611-45,01-510,GUATEMALA,SANTA CATARINA PINULA,INSTITUTO PRIVADO MIXTO DE EDUCACION BASICA 'COLEGIO LA INMACULADA',1A CALLE 4-61 ZONA 1,23632386,ZOILA ESPERANZA CAMEY ATZ,,BASICO,PRIVADO,URBANA,CERRADA TEMPORALMENTE,MONOLINGUE,VESPERTINA,DIARIO(REGULAR),GUATEMALA ORIENTE
01-02-4017-45,01-510,GUATEMALA,SANTA CATARINA PINULA,COLEGIO PRIVADO MIXTO 'RAUL ECHEVERRIA MAGARIÑO',2A. AVENIDA 4-124 ZONA 1,23630843,ZOILA ESPERANZA CAMEY ATZ,,BASICO,PRIVADO,URBANA,CERRADA TEMPORALMENTE,MONOLINGUE,MATUTINA,DIARIO(REGULAR),GUATEMALA ORIENTE
01-02-4338-45,,GUATEMALA,SANTA CATARINA PINULA,IGER,SANTA CATARINA PINULA,,,,BASICO,PRIVADO,URBANA,CERRADA TEMPORALMENTE,MONOLINGUE,MATUTINA,A DISTANCIA,GUATEMALA ORIENTE
01-02-6170-45,01-502,GUATEMALA,SANTA CATARINA PINULA,COLEGIO BILINGUE 'VALLES DE VISTA HERMOSA',KM. 18.5 CARRETERA A EL SALVADOR LOTIFICACION LAS MARGARITAS LOTE 26,66342012,JULIA ENECON ROCA MORAN,P.E.M. MASHA EUGENIA DURÁN ALDNA DE MASELLI,BASICO,PRIVADO,URBANA,ABIERTA,MONOLINGUE,MATUTINA,DIARIO(REGULAR),GUATEMALA ORIENTE
01-02-6763-45,01-502,GUATEMALA,SANTA CATARINA PINULA,COLEGIO MAYA DE GUATEMALA,"KILOMETRO 12.5, CARRETERA A EL SALVADOR",66441200,JULIA ENECON ROCA MORAN,VILMA LORENA LEON OLIVA DE HERNANDEZ,BASICO,PRIVADO,RURAL,ABIERTA,MONOLINGUE,MATUTINA,DIARIO(REGULAR),GUATEMALA ORIENTE
01-02-7140-45,01-510,GUATEMALA,SANTA CATARINA PINULA,COLEGIO EL CARMEN,SECTOR SUR NO.6 CASA NO. 61 ALDEA EL CARMEN,52039803,ZOILA ESPERANZA CAMEY ATZ,,BASICO,PRIVADO,RURAL,ABIERTA,MONOLINGUE,VESPERTINA,DIARIO(REGULAR),GUATEMALA ORIENTE
01-02-7144-45,01-644,GUATEMALA,SANTA CATARINA PINULA,COLEGIO MIXTO CONCEPCION,NO.423 ALDEA EL PAJON,66374795,LIGIA DEL ROSARIO RICCI VELASQUEZ,,BASICO,PRIVADO,RURAL,ABIERTA,MONOLINGUE,VESPERTINA,DIARIO(REGULAR),GUATEMALA ORIENTE
01-02-7146-45,01-644,GUATEMALA,SANTA CATARINA PINULA,COLEGIO PALO ALTO,KM. 16.5 CARRETERA A EL SALVADOR,66370173,LIGIA DEL ROSARIO RICCI VELASQUEZ,THELMA YOLANDA MADRID CACHIN DE PÉREZ,BASICO,PRIVADO,RURAL,ABIERTA,MONOLINGUE,MATUTINA,DIARIO(REGULAR),GUATEMALA ORIENTE
01-02-7152-45,01-510,GUATEMALA,SANTA CATARINA PINULA,COLEGIO PARROQUIAL FRANCISCO GARCIA PELAEZ,1A. CALLE Y 1A. AVENIDA ZONA 1,23686053,ZOILA ESPERANZA CAMEY ATZ,VILMA YOLANDA BAILÓN GONZÁLEZ,BASICO,PRIVADO,URBANA,ABIERTA,MONOLINGUE,MATUTINA,DIARIO(REGULAR),GUATEMALA ORIENTE
01-02-7440-45,01-644,GUATEMALA,SANTA CATARINA PINULA,COLEGIO METROPOLITANO,"KM. 16.5 CARRETERA A PIEDRA PARADA, CRISTO REY",66417400,LIGIA DEL ROSARIO RICCI VELASQUEZ,ALBIS JUDITH OCHOA RAMÍREZ DE SOLARES,BASICO,PRIVADO,RURAL,ABIERTA,MONOLINGUE,MATUTINA,DIARIO(REGULAR),GUATEMALA ORIENTE
01-02-7484-45,01-510,GUATEMALA,SANTA CATARINA PINULA,LICEO MIXTO CRISTIANO CARMENSE,SECTOR CENTRAL 3 CASA 42,66291796,ZOILA ESPERANZA CAMEY ATZ,ENMA PATRICIA ZACARÍAS LIMA,BASICO,PRIVADO,RURAL,ABIERTA,MONOLINGUE,MATUTINA,DIARIO(REGULAR),GUATEMALA ORIENTE
01-02-7550-45,01-645,GUATEMALA,SANTA CATARINA PINULA,INSTITUTO DE EDUCACIÓN BÁSICA POR COOPERATIVA,ALDEA CUCHILLA DEL CARMEN,53398319,ALBA MARICELA JOR PORTILLO,,BASICO,COOPERATIVA,RURAL,ABIERTA,MONOLINGUE,VESPERTINA,DIARIO(REGULAR),GUATEMALA ORIENTE
01-02-7828-45,01-502,GUATEMALA,SANTA CATARINA PINULA,COLEGIO LA PLACE,KM. 18.5 CARRETERA AL SALVADOR CRUCE CARRETERA VIEJA,66346612,JULIA ENECON ROCA MORAN,,BASICO,PRIVADO,URBANA,ABIERTA,MONOLINGUE,MATUTINA,DIARIO(REGULAR),GUATEMALA ORIENTE
01-02-8064-45,01-502,GUATEMALA,SANTA CATARINA PINULA,CENTRO EDUCATIVO 'EL PERPETUO SOCORRO',"CARRETERA ANTIGUO A EL SALVADOR, KM. 15.5",66373695,JULIA ENECON ROCA MORAN,PEM. KARLA GRACIELA ROSAS MOLINA,BASICO,PRIVADO,RURAL,ABIERTA,MONOLINGUE,MATUTINA,DIARIO(REGULAR),GUATEMALA ORIENTE
01-02-8065-45,01-644,GUATEMALA,SANTA CATARINA PINULA,COLEGIO MIXTO SAN ANTONIO DE PADUA,3AV 1-54 PIEDRA PARADA CRISTO REY,66327247,LIGIA DEL ROSARIO RICCI VELASQUEZ,,BASICO,PRIVADO,RURAL,ABIERTA,MONOLINGUE,VESPERTINA,DIARIO(REGULAR),GUATEMALA ORIENTE
01-02-8545-45,01-502,GUATEMALA,SANTA CATARINA PINULA,COLEGIO 'DISCOVERY',"KM. 14.5 CARRETERA A EL SALVADOR, RESIDENCIALES SANTA BARBARA",66375942,JULIA ENECON ROCA MORAN,,BASICO,PRIVADO,URBANA,ABIERTA,MONOLINGUE,MATUTINA,DIARIO(REGULAR),GUATEMALA ORIENTE
01-02-8792-45,01-510,GUATEMALA,SANTA CATARINA PINULA,COLEGIO MIXTO TECNICO EN COMPUTACION VISTA AZUL,1A. CALLE CUCHILLA DEL CARMEN,24438611,ZOILA ESPERANZA CAMEY ATZ,MIRNA PATRICIA CASTILLO SAMAYOA DE VELÁSQUEZ,BASICO,PRIVADO,RURAL,ABIERTA,MONOLINGUE,MATUTINA,DIARIO(REGULAR),GUATEMALA ORIENTE
01-02-8827-45,01-510,GUATEMALA,SANTA CATARINA PINULA,COLEGIO MIXTO 'ARCA DE SALVACION',1A. CALLE Y 7A. AVENIDA 'B' 1-06 CUCHILLA DEL CARMEN,34014758,ZOILA ESPERANZA CAMEY ATZ,,BASICO,PRIVADO,RURAL,CERRADA TEMPORALMENTE,MONOLINGUE,MATUTINA,DIARIO(REGULAR),GUATEMALA ORIENTE
01-02-9283-45,01-508,GUATEMALA,SANTA CATARINA PINULA,CENTRO ESCOLAR ENTREVALLES,CA1 ANTIGUA CARRETERA A EL SALVADOR KM. 16.8 ENTRADA A SAN ANTONIO,66854700,MANUEL MARIA CANO CASTRO,MARIA DEL CARMEN MARROQUÍN TOBÍAS DE CAMEY,BASICO,PRIVADO,RURAL,ABIERTA,MONOLINGUE,MATUTINA,DIARIO(REGULAR),GUATEMALA ORIENTE
01-02-9516-45,01-645,GUATEMALA,SANTA CATARINA PINULA,IEBC 'EL CARMEN',SECTOR II ALDEA EL CARMEN,30231688,ALBA MARICELA JOR PORTILLO,,BASICO,COOPERATIVA,RURAL,ABIERTA,MONOLINGUE,VESPERTINA,DIARIO(REGULAR),GUATEMALA ORIENTE
01-02-9532-45,01-645,GUATEMALA,SANTA CATARINA PINULA,IEBC NUEVA CONCEPCION,ALDEA NUEVA CONCEPCION,66420072,ALBA MARICELA JOR PORTILLO,SONIA ELIZABETH REYES MEDINA,BASICO,COOPERATIVA,RURAL,ABIERTA,MONOLINGUE,VESPERTINA,DIARIO(REGULAR),GUATEMALA ORIENTE
01-02-9747-45,01-502,GUATEMALA,SANTA CATARINA PINULA,COLEGIO ARRAYANES,KM. 9.5 ANTIGUA CARRETERA A EL SALVADOR FINCA SAN JORGE MUXBAL CASA MUXBAL,66420121-66420111,JULIA ENECON ROCA MORAN,,BASICO,PRIVADO,URBANA,CERRADA TEMPORALMENTE,MONOLINGUE,MATUTINA,DIARIO(REGULAR),GUATEMALA ORIENTE
01-03-0002-45,01-637,GUATEMALA,SAN JOSE PINULA,CENTRO DEL NUCLEO FAMILIAR EDUCATIVO PARA EL DESARROLLO NUFED NO. 532,ALDEA MONTE REDONDO,40470565,SILVIA EUGENIA VALDEZ MONTERROSO DE CARBALLO,---,BASICO,OFICIAL,RURAL,ABIERTA,MONOLINGUE,VESPERTINA,DIARIO(REGULAR),GUATEMALA ORIENTE
01-03-0006-45,01-624,GUATEMALA,SAN JOSE PINULA,"COLEGIO INTEGRAL ""MIGUEL ANGEL ASTURIAS""",7A. AVENIDA 2-03 ZONA 3,66343433,ROSENDA CORINA SALAY ALBIZURES,CARLOS ALBERTO ARANGO ROSAL,BASICO,PRIVADO,URBANA,ABIERTA,MONOLINGUE,MATUTINA,DIARIO(REGULAR),GUATEMALA ORIENTE
01-03-0009-45,01-633,GUATEMALA,SAN JOSE PINULA,INSTITUTO NACIONAL DE EDUCACIÓN BÁSICA,1A. AVENIDA 2-29 ZONA 1,66415108,MAYRA HORTENSIA RUSTRIAN ECUTE,MARÍAN JOSEFINA MAYÉN ESCALANTE,BASICO,OFICIAL,URBANA,ABIERTA,MONOLINGUE,VESPERTINA,DIARIO(REGULAR),GUATEMALA ORIENTE
01-03-0010-45,01-624,GUATEMALA,SAN JOSE PINULA,INEB,"SECTOR 2 PUERTA NEGRA, ALDEA SAN LUIS",54674593,ROSENDA CORINA SALAY ALBIZURES,---,BASICO,OFICIAL,RURAL,ABIERTA,MONOLINGUE,VESPERTINA,DIARIO(REGULAR),GUATEMALA ORIENTE
01-03-0011-45,01-624,GUATEMALA,SAN JOSE PINULA,INEB,ALDEA CIENEGA GRANDE,56273077,ROSENDA CORINA SALAY ALBIZURES,HUGO ROLANDO RAMÍREZ GÓMEZ,BASICO,OFICIAL,RURAL,ABIERTA,MONOLINGUE,VESPERTINA,DIARIO(REGULAR),GUATEMALA ORIENTE
01-03-0012-45,01-624,GUATEMALA,SAN JOSE PINULA,INEB,ALDEA EL TULAR,53264124,ROSENDA CORINA SALAY ALBIZURES,---,BASICO,OFICIAL,RURAL,ABIERTA,MONOLINGUE,VESPERTINA,DIARIO(REGULAR),GUATEMALA ORIENTE
01-03-0014-45,01-633,GUATEMALA,SAN JOSE PINULA,INEB DE TELESECUNDARIA,ALDEA EL ZAPOTE,48852425,MAYRA HORTENSIA RUSTRIAN ECUTE,CRISTINA DEL ROSARIO LORENZANA,BASICO,OFICIAL,RURAL,ABIERTA,MONOLINGUE,VESPERTINA,DIARIO(REGULAR),GUATEMALA ORIENTE
01-03-0021-45,01-633,GUATEMALA,SAN JOSE PINULA,"LICEO MIXTO ""CENTRO AMERICANO"" SAN JOSE","8A. AVENIDA 13-72, ZONA 4",66415205,MAYRA HORTENSIA RUSTRIAN ECUTE,LUIS ANTONIO GARCIA GUZMAN,BASICO,PRIVADO,URBANA,ABIERTA,MONOLINGUE,VESPERTINA,DIARIO(REGULAR),GUATEMALA ORIENTE
01-03-0030-45,01-624,GUATEMALA,SAN JOSE PINULA,INEB DE TELESECUNDARIA,"CASERIO EL CEDRITO, ALDEA LAS NUBES",57831341,ROSENDA CORINA SALAY ALBIZURES,---,BASICO,OFICIAL,RURAL,ABIERTA,MONOLINGUE,VESPERTINA,DIARIO(REGULAR),GUATEMALA ORIENTE
01-03-0031-45,01-633,GUATEMALA,SAN JOSE PINULA,INEB DE TELESECUNDARIA,ALDEA SANTA INES,47400966,MAYRA HORTENSIA RUSTRIAN ECUTE,---,BASICO,OFICIAL,RURAL,ABIERTA,MONOLINGUE,VESPERTINA,DIARIO(REGULAR),GUATEMALA ORIENTE
01-03-0034-45,01-506,GUATEMALA,SAN JOSE PINULA,CENTRO EDUCATIVO CASTELVERDE,KM. 25.5 CARRETERA A MATAQUESCUINTLA,66348347,BLANCA SARAI GUTIERREZ PINEDA,DENIS ROLANDO VÉLIZ FERNÁNDEZ,BASICO,PRIVADO,RURAL,CERRADA TEMPORALMENTE,MONOLINGUE,MATUTINA,DIARIO(REGULAR),GUATEMALA ORIENTE
01-03-0044-45,01-624,GUATEMALA,SAN JOSE PINULA,COLEGIO HERALDOS DEL EVANGELIO INTERNACIONAL,"KILOMETRO 30, CARRETERA A FINCA AGUA TIBIA",40814820,ROSENDA CORINA SALAY ALBIZURES,MIRIAM ARACELY MOREIRA CASTILLO,BASICO,PRIVADO,URBANA,ABIERTA,MONOLINGUE,VESPERTINA,DIARIO(REGULAR),GUATEMALA ORIENTE
01-03-0064-45,01-506,GUATEMALA,SAN JOSE PINULA,INSTITUTO NACIONAL DE EDUCACIÒN BASICA DE TELESECUNDARIA HOGAR SEGURO VIRGEN DE LA ASUNCIÒN,"FINCA SAN ANTONIO ,ALDEA EL PLATANAR",66343124,BLANCA SARAI GUTIERREZ PINEDA,JUAN HERVER ARTURO PACHECO SOLIS,BASICO,OFICIAL,RURAL,CERRADA TEMPORALMENTE,MONOLINGUE,VESPERTINA,DIARIO(REGULAR),GUATEMALA ORIENTE
01-03-0069-45,01-633,GUATEMALA,SAN JOSE PINULA,LICEO MIXTO PINULTECO,4A. CALLE 4-24 ZONA 1,66348322,MAYRA HORTENSIA RUSTRIAN ECUTE,ALMA CORILIA PORRES DE GARCÍA,BASICO,PRIVADO,URBANA,ABIERTA,MONOLINGUE,MATUTINA,DIARIO(REGULAR),GUATEMALA ORIENTE
01-03-0070-45,01-633,GUATEMALA,SAN JOSE PINULA,LICEO MIXTO PINULTECO,4A. CALLE 4-24 ZONA 1,66348322,MAYRA HORTENSIA RUSTRIAN ECUTE,ALMA CORILIA PORRES DE GARCÍA,BASICO,PRIVADO,URBANA,ABIERTA,MONOLINGUE,VESPERTINA,DIARIO(REGULAR),GUATEMALA ORIENTE
01-03-0073-45,01-405,GUATEMALA,SAN JOSE PINULA,LICEO MIXTO PINULTECO,4A. CALLE 4-24 ZONA 1,66348322,BLANCA SARAI GUTIERREZ PINEDA,ALMA CORILIA PORRES DE GARCÍA,BASICO,PRIVADO,URBANA,ABIERTA,MONOLINGUE,DOBLE,FIN DE SEMANA,GUATEMALA ORIENTE
01-03-0077-45,01-633,GUATEMALA,SAN JOSE PINULA,CENTRO EDUCATIVO ENTRE CAMPOS,3A. CALLE 10-57 ZONA 2,66718400,MAYRA HORTENSIA RUSTRIAN ECUTE,JUAN MANUEL IBOY SALAY,BASICO,PRIVADO,URBANA,ABIERTA,MONOLINGUE,MATUTINA,DIARIO(REGULAR),GUATEMALA ORIENTE
01-03-0078-45,01-405,GUATEMALA,SAN JOSE PINULA,LICEO MIXTO PINULTECO,4A. CALLE 4-24 ZONA 1,66348322,BLANCA SARAI GUTIERREZ PINEDA,ALMA CORILIA PORRES DE GARCÍA,BASICO,PRIVADO,URBANA,ABIERTA,MONOLINGUE,DOBLE,FIN DE SEMANA,GUATEMALA ORIENTE
01-03-0079-45,01-624,GUATEMALA,SAN JOSE PINULA,INEB TELESECUNDARIA,ALDEA EL PLATANAR,52606674,ROSENDA CORINA SALAY ALBIZURES,CARMEN MONTERROSO,BASICO,OFICIAL,RURAL,ABIERTA,MONOLINGUE,VESPERTINA,DIARIO(REGULAR),GUATEMALA ORIENTE
01-03-0082-45,01-624,GUATEMALA,SAN JOSE PINULA,COLEGIO INTERNACIONAL SYNERGY,"KM. 20.5 CARRETERA A SAN JOSÉ PINULA, LOTE 40, CALLEJÓN LOS ALVAREZ ALDEA SANTA INÉS PINULA",66273000,ROSENDA CORINA SALAY ALBIZURES,EMMA CAROLINA CONTRERAS AVENDAÑO,BASICO,PRIVADO,RURAL,ABIERTA,MONOLINGUE,MATUTINA,DIARIO(REGULAR),GUATEMALA ORIENTE
01-03-0088-45,01-633,GUATEMALA,SAN JOSE PINULA,"LICEO CRISTIANO ""APOSENTO ALTO""",5A. CALLE 7-29 ZONA 4,66415990-56652813,MAYRA HORTENSIA RUSTRIAN ECUTE,LAIZA JEANNETE CIFUENTES PINEDA DE PÉREZ,BASICO,PRIVADO,URBANA,ABIERTA,MONOLINGUE,MATUTINA,DIARIO(REGULAR),GUATEMALA ORIENTE
01-03-0089-45,01-633,GUATEMALA,SAN JOSE PINULA,COLEGIO MIXTO SUPERACIÓN Y DESARROLLO,3A. CALLE 2-22 ZONA 4,66617118,MAYRA HORTENSIA RUSTRIAN ECUTE,ALVARO EDUARDO SOTOJ ALVAREZ,BASICO,PRIVADO,URBANA,ABIERTA,MONOLINGUE,MATUTINA,DIARIO(REGULAR),GUATEMALA ORIENTE
01-03-0090-45,01-633,GUATEMALA,SAN JOSE PINULA,COLEGIO MIXTO SUPERACIÓN Y DESARROLLO,3A. CALLE 2-22 ZONA 4,66617118,MAYRA HORTENSIA RUSTRIAN ECUTE,VILMA VICTORIA MENDOZA SOLARES,BASICO,PRIVADO,URBANA,ABIERTA,MONOLINGUE,VESPERTINA,DIARIO(REGULAR),GUATEMALA ORIENTE
01-03-0095-45,01-633,GUATEMALA,SAN JOSE PINULA,COLEGIO TÉCNICO PANAMERICANO,6A. AVENIDA 0-41 CALLEJÓN LOS MUNDOS ALDEA SANTA INÉS PINULA,66418724,MAYRA HORTENSIA RUSTRIAN ECUTE,HEIDY ROXANA MARROQUÍN GARCÍA,BASICO,PRIVADO,RURAL,ABIERTA,MONOLINGUE,MATUTINA,DIARIO(REGULAR),GUATEMALA ORIENTE
01-03-0100-45,01-624,GUATEMALA,SAN JOSE PINULA,COLEGIO DE CAMPO (COUNTRY SCHOOL) NO. 2,"LOTE 7, MANZANA N, SECTOR COMERCIAL RESIDENCIALES SAN JOSÉ PINULA",46208985,ROSENDA CORINA SALAY ALBIZURES,DELMY LUCESITA FIGUEROA MIJANGOS,BASICO,PRIVADO,URBANA,ABIERTA,MONOLINGUE,MATUTINA,DIARIO(REGULAR),GUATEMALA ORIENTE
01-03-0103-45,01-624,GUATEMALA,SAN JOSE PINULA,COLEGIO CIENCIA Y DESARROLLO,"MANZANA L, LOTE 15, SECTOR II RESIDENCIALES SAN JOSÉ",66269679,ROSENDA CORINA SALAY ALBIZURES,NIVIA ELI ALFARO CASTAÑEDA,BASICO,PRIVADO,RURAL,ABIERTA,MONOLINGUE,MATUTINA,DIARIO(REGULAR),GUATEMALA ORIENTE
01-03-0105-45,01-624,GUATEMALA,SAN JOSE PINULA,COLEGIO MIXTO MARÍA CONCEPCIÓN,3A. CALLE 3-12 ZONA 4,66415381,ROSENDA CORINA SALAY ALBIZURES,,BASICO,PRIVADO,URBANA,ABIERTA,MONOLINGUE,MATUTINA,DIARIO(REGULAR),GUATEMALA ORIENTE
01-03-0109-45,01-624,GUATEMALA,SAN JOSE PINULA,COLEGIO CIENCIA Y DESARROLLO,"MANZANA L, LOTE 15, SECTOR II, RESIDENCIALES SAN JOSÉ",66692545,ROSENDA CORINA SALAY ALBIZURES,PEM SANDRA MIROSLAVA ARMAS MAZARIEGOS,BASICO,PRIVADO,RURAL,ABIERTA,MONOLINGUE,VESPERTINA,DIARIO(REGULAR),GUATEMALA ORIENTE
01-03-0111-45,01-624,GUATEMALA,SAN JOSE PINULA,ESCUELA MIRINE,"FINCA EL MORA, CARRETERA A EL SALVADOR",59309137,ROSENDA CORINA SALAY ALBIZURES,JOSÉ ALEJANDRA ALVAREZ HERNÁNDEZ,BASICO,PRIVADO,RURAL,ABIERTA,MONOLINGUE,MATUTINA,DIARIO(REGULAR),GUATEMALA ORIENTE
01-03-0114-45,01-624,GUATEMALA,SAN JOSE PINULA,LICEO CRISTIANO AMISHALOM,8A. CALLE 2-30 ZONA 3,51561393,ROSENDA CORINA SALAY ALBIZURES,KAREN MARLENY HERRERA ESTRADA,BASICO,PRIVADO,URBANA,ABIERTA,MONOLINGUE,MATUTINA,DIARIO(REGULAR),GUATEMALA ORIENTE
01-03-0122-45,01-502,GUATEMALA,SAN JOSE PINULA,IPMB COLEGIO BILINGÜE INTEGRIDAD ( INTEGRITY ),"KM.16.5 CARRETERA A SAN JOSÉ PINULA, CASERIO LA LAGUNETA, ALDEA DON JUSTO, SANTA CATARINA PINULA. GUATEMALA",66371400,JULIA ENECON ROCA MORAN,PEM. MARIA VERONICA AUYON OCAMPO DE GALICIA,BASICO,PRIVADO,URBANA,ABIERTA,MONOLINGUE,DOBLE,A DISTANCIA,GUATEMALA ORIENTE
01-03-0123-45,01-502,GUATEMALA,SAN JOSE PINULA,COLEGIO BILINGÜE INTEGRIDAD ( INTEGRITY ),"KM.16.5 CARRETERA A SAN JOSÉ PINULA, CASERIO LA LAGUNETA, ALDEA DON JUSTO, SANTA CATARINA PINULA. GUATEMALA",66371400,JULIA ENECON ROCA MORAN,PEM. MARIA VERONICA AUYON OCAMPO DE GALICIA,BASICO,PRIVADO,URBANA,ABIERTA,MONOLINGUE,DOBLE,A DISTANCIA,GUATEMALA ORIENTE
01-03-0126-45,01-502,GUATEMALA,SAN JOSE PINULA,COLEGIO BILINGÜE INTEGRIDAD ( INTEGRITY ),"KM.16.5 CARRETERA A SAN JOSÉ PINULA, CASERIO LA LAGUNETA, ALDEA DON JUSTO, SANTA CATARINA PINULA. GUATEMALA",66371400,JULIA ENECON ROCA MORAN,MARIA VERONICA AUYON OCAMPO DE GALICIA,BASICO,PRIVADO,URBANA,ABIERTA,MONOLINGUE,DOBLE,SEMIPRESENCIAL,GUATEMALA ORIENTE
01-03-0131-45,01-633,GUATEMALA,SAN JOSE PINULA,"CENTRO EDUCATIVO "" EL PROGRESO """,5A. CALLE 2-50 ZONA 2 GUATEMALA,66348335,MAYRA HORTENSIA RUSTRIAN ECUTE,OMAR ALEJANDRO ENRIQUE CIFUENTES SILVESTRE,BASICO,PRIVADO,URBANA,ABIERTA,MONOLINGUE,DOBLE,FIN DE SEMANA,GUATEMALA ORIENTE
01-03-0137-45,01-405,GUATEMALA,SAN JOSE PINULA,COLEGIO INTEGRAL EBENEZER,2A. AVENIDA 4-34 CANTON MATAZANO ZONA 4,66617878,BLANCA SARAI GUTIERREZ PINEDA,SARA VENTURA VELASQUEZ GUZMAN,BASICO,PRIVADO,URBANA,ABIERTA,MONOLINGUE,DOBLE,FIN DE SEMANA,GUATEMALA ORIENTE
01-03-0138-45,01-405,GUATEMALA,SAN JOSE PINULA,COLEGIO INTEGRAL EBENEZER,2A. AVENIDA 4-34 CANTON MATAZANO ZONA 4,66617878,BLANCA SARAI GUTIERREZ PINEDA,SARA VENTURA VELASQUEZ GUZMAN,BASICO,PRIVADO,URBANA,ABIERTA,MONOLINGUE,DOBLE,FIN DE SEMANA,GUATEMALA ORIENTE
01-03-0140-45,01-502,GUATEMALA,SAN JOSE PINULA,COLEGIO BILINGÜE INTEGRIDAD ( INTEGRITY ),"KM. 17 CARRETERA A SAN JOSÉ PINULA, LOTE 3 ""A"" ZONA 7 MUNICIPIO DE SANTA CATARINA PINULA GUATEMALA",66371400,JULIA ENECON ROCA MORAN,MARÍA VERONICA AUYÓN OCAMPO,BASICO,PRIVADO,URBANA,ABIERTA,MONOLINGUE,DOBLE,DIARIO(REGULAR),GUATEMALA ORIENTE
01-03-0143-45,01-624,GUATEMALA,SAN JOSE PINULA,LICEO CRISTIANO REY SALOMÓN,5TA CALLE 7-29 ZONA 4 SAN JOSE PINULA,30221534,ROSENDA CORINA SALAY ALBIZURES,PEM. ANABELLA MONZÓN DE PALENCIA,BASICO,PRIVADO,URBANA,ABIERTA,MONOLINGUE,MATUTINA,DIARIO(REGULAR),GUATEMALA ORIENTE
