CODIGO,DISTRITO,DEPARTAMENTO,MUNICIPIO,ESTABLECIMIENTO,DIRECCION,TELEFONO,SUPERVISOR,DIRECTOR,NIVEL,SECTOR,AREA,STATUS,MODALIDAD,JORNADA,PLAN,DEPARTAMENTAL
01-10-0204-45,01-610,GUATEMALA,SAN JUAN SACATEPEQUEZ,"COLEGIO MIXTO MARIANO "" TOTUS TUUS """,9NA. AVENIDA 7-07 ZONA 1,66303803,LESBIA MARICELA COTZOJAY PATZAN,MARIA ELENA ALQUIJAY PIRIR,BASICO,PRIVADO,URBANA,ABIERTA,MONOLINGUE,MATUTINA,DIARIO(REGULAR),GUATEMALA OCCIDENTE
01-10-0205-45,01-610,GUATEMALA,SAN JUAN SACATEPEQUEZ,"COLEGIO MIXTO MARIANO ""TOTUS TUUS""",9NA. AVENIDA 7-07 ZONA 1,66303803,LESBIA MARICELA COTZOJAY PATZAN,MARIA ELENA ALQUIJAY PIRIR,BASICO,PRIVADO,URBANA,CERRADA TEMPORALMENTE,MONOLINGUE,VESPERTINA,DIARIO(REGULAR),GUATEMALA OCCIDENTE
01-10-0206-45,01-647,GUATEMALA,SAN JUAN SACATEPEQUEZ,COLEGIO CRISTIANO REY DE REYES,MANZANA 15 LOTE 23 VILLAS DEL QUETZAL CIUDAD QUETZAL,66830734,VINICIO ARNOLDO NAJERA CARDONA,DELIA ESPERANZA BAJXAC GARCIA,BASICO,PRIVADO,URBANA,ABIERTA,MONOLINGUE,MATUTINA,DIARIO(REGULAR),GUATEMALA OCCIDENTE
01-10-0213-45,01-622,GUATEMALA,SAN JUAN SACATEPEQUEZ,INSTITUTO MUNICIPAL DE EDUCACIÓN BASICA,CASERIO SANTA ROSA ALDEA ESTANCIA GRANDE,35130918,CRISTOBAL DE JESUS SANTIZO ROSALES,CRISTOBAL DE JESUS SANTIZO ROSALES,BASICO,MUNICIPAL,RURAL,ABIERTA,MONOLINGUE,VESPERTINA,DIARIO(REGULAR),GUATEMALA OCCIDENTE
01-10-0214-45,01-636,GUATEMALA,SAN JUAN SACATEPEQUEZ,COLEGIO MIXTO EL BUEN PASTOR,CALLE EL JOCOTILLO LOTE NO. 36 Y 37 LO DE CARRANZA,47619570,MARIO ALEJANDRO NAJARRO GARCIA SALAS,NORMA FLORIDALMA MUÑOZ PINTO DE ROMÁN,BASICO,PRIVADO,RURAL,CERRADA TEMPORALMENTE,MONOLINGUE,VESPERTINA,DIARIO(REGULAR),GUATEMALA OCCIDENTE
01-10-0215-45,01-636,GUATEMALA,SAN JUAN SACATEPEQUEZ,"CENTRO EDUCATIVO CRISTIANO PRIVADO ""MONTE CARMELO""",LOTE 3 MANZANA D SECTOR 2 MONTE CARMELO 1 CACERIO LO DE CARRANZA,43344453,MARIO ALEJANDRO NAJARRO GARCIA SALAS,CLAUDIA ROSSMERY OSORIO HERRERA,BASICO,PRIVADO,RURAL,ABIERTA,MONOLINGUE,VESPERTINA,DIARIO(REGULAR),GUATEMALA OCCIDENTE
01-10-0223-45,01-636,GUATEMALA,SAN JUAN SACATEPEQUEZ,"CENTRO EDUCATIVO CRISTIANO PRIVADO ""MONTE CARMELO""","LOTE 3 MANZANA ""D"" SECTOR 2 MONTE CARMELO I, LO DE CARRANZA",44397543,MARIO ALEJANDRO NAJARRO GARCIA SALAS,CLAUDIA ROSSMERY OSORIO HERRERA DE LÓPEZ,BASICO,PRIVADO,RURAL,ABIERTA,BILINGUE,MATUTINA,DIARIO(REGULAR),GUATEMALA OCCIDENTE
01-10-0226-45,01-647,GUATEMALA,SAN JUAN SACATEPEQUEZ,COLEGIO CRISTIANO MONTE CALEB,"3A. CALLE ""A"" 3-32 COLONIA SAN FRANCISCO DEL BOSQUEIII CARRETERA A CIUDAD QUETZAL",55885284,VINICIO ARNOLDO NAJERA CARDONA,DELIA ESPERANZA BAJXAC GARCIA,BASICO,PRIVADO,URBANA,ABIERTA,MONOLINGUE,VESPERTINA,DIARIO(REGULAR),GUATEMALA OCCIDENTE
01-10-0229-45,01-622,GUATEMALA,SAN JUAN SACATEPEQUEZ,"INEB INSTITUTO NACIONAL DE EDUCACIÓN BÁSICA ""OSCAR FERNANDO BRACAMONTE MÁRQUEZ""","CASERIO PACHUN, ALDEA MONTUFAR",46453116,CRISTOBAL DE JESUS SANTIZO ROSALES,YOLANDA MUTZÚS PIRIR DE ESTRADA,BASICO,OFICIAL,RURAL,ABIERTA,MONOLINGUE,VESPERTINA,DIARIO(REGULAR),GUATEMALA OCCIDENTE
01-10-0231-45,01-410,GUATEMALA,SAN JUAN SACATEPEQUEZ,COLEGIO MIXTO EL BUEN PASTOR,LOTE 36 Y 37 CALLE EL JOCOTILLO LO DE CARRANZA,47619570,CEDWIN EUGENIO CRUZ BUCARO,DELIA ESPERANZA BAJXAC GARCÍA,BASICO,PRIVADO,RURAL,CERRADA TEMPORALMENTE,MONOLINGUE,DOBLE,FIN DE SEMANA,GUATEMALA OCCIDENTE
01-10-0236-45,01-647,GUATEMALA,SAN JUAN SACATEPEQUEZ,COLEGIO MIXTO PRIVADO LA LUZ,4A. AVENIDA 11-12 MANZANA P CIUDAD QUETZAL,32210758,VINICIO ARNOLDO NAJERA CARDONA,JOSÉ LUIS VEGA GUEVARA,BASICO,PRIVADO,RURAL,ABIERTA,MONOLINGUE,VESPERTINA,DIARIO(REGULAR),GUATEMALA OCCIDENTE
01-10-0237-45,01-622,GUATEMALA,SAN JUAN SACATEPEQUEZ,CENTRO EDUCATIVO PROFESIONAL INTEGRAL,KILOMETRO 36.5 LOTE 12 ALDEA COMUNIDAD DE RUIZ,47395508,CRISTOBAL DE JESUS SANTIZO ROSALES,NANCY KARINA BAC GUAT,BASICO,PRIVADO,RURAL,ABIERTA,MONOLINGUE,MATUTINA,DIARIO(REGULAR),GUATEMALA OCCIDENTE
01-10-0239-45,01-647,GUATEMALA,SAN JUAN SACATEPEQUEZ,COLEGIO CRISTIANO OXFORD,LOTE 7 Y 8 MANZANA X 2 RESIDENCIALES EL QUETZAL KM. 21.5 CARRETERA A CIUDAD QUETZAL,50457088,VINICIO ARNOLDO NAJERA CARDONA,SILVIA AZUCENA COC NOJ,BASICO,PRIVADO,RURAL,ABIERTA,MONOLINGUE,MATUTINA,DIARIO(REGULAR),GUATEMALA OCCIDENTE
01-10-0249-45,01-647,GUATEMALA,SAN JUAN SACATEPEQUEZ,"COLEGIO EVANGÉLICO ""JESÚS EL MESÍAS""","LOTE 15,16,17 Y 18 MANZANA ""G"" SECTOR 1 VILLA VERDE, CIUDAD QUETZAL",22113450,VINICIO ARNOLDO NAJERA CARDONA,DEYSU ROMELIA SUYÉN CANO,BASICO,PRIVADO,RURAL,ABIERTA,MONOLINGUE,VESPERTINA,DIARIO(REGULAR),GUATEMALA OCCIDENTE
01-10-0250-45,01-639,GUATEMALA,SAN JUAN SACATEPEQUEZ,CENTRO DE EDUCACIÓN EXTRAESCOLAR- CEEX- GROUP OF GOOD SAMARITAN,"MANZANA G, LOTE 8 ZONA 0, PRADOS DE CIUDAD QUETZAL",55582135,ANDREA VANESSA ALDANA VILLAGRAN DE CASTRO,KELITA BETSABÉ NORIEGA MORALES,BASICO,PRIVADO,RURAL,CERRADA TEMPORALMENTE,MONOLINGUE,DOBLE,A DISTANCIA,GUATEMALA OCCIDENTE
01-10-0252-45,01-410,GUATEMALA,SAN JUAN SACATEPEQUEZ,"COLEGIO EVANGÉLICO ""JESÚS EL MESÍAS""","LOTE 15,16,17 Y 18 MANZANA ""G"" SECTOR 1 VILLA VERDE, CIUDAD QUETZAL",22113450,CEDWIN EUGENIO CRUZ BUCARO,DEYSI ROMELIA SUYÉN CANO,BASICO,PRIVADO,RURAL,ABIERTA,MONOLINGUE,DOBLE,FIN DE SEMANA,GUATEMALA OCCIDENTE
01-10-0253-45,01-410,GUATEMALA,SAN JUAN SACATEPEQUEZ,"COLEGIO EVANGÉLICO ""JESÚS EL MESÍAS""","LOTE 15,16,17 Y 18 MANZANA ""G"" SECTOR 1 VILLA VERDE, CIUDAD QUETZAL",22113450,CEDWIN EUGENIO CRUZ BUCARO,DEYSI ROMELIA SUYÉN CANO,BASICO,PRIVADO,RURAL,ABIERTA,MONOLINGUE,DOBLE,FIN DE SEMANA,GUATEMALA OCCIDENTE
01-10-0257-45,01-639,GUATEMALA,SAN JUAN SACATEPEQUEZ,CENTRO DE EDUCACIÓN EXTRAESCOLAR CEEX INNOVADORES DE ÉXITO,"SECTOR 3, ALDEA LO DE MEJIA",54144450,ANDREA VANESSA ALDANA VILLAGRAN DE CASTRO,FLORENCIA ADILIA MARTÍNEZ GUTIERREZ,BASICO,PRIVADO,RURAL,CERRADA TEMPORALMENTE,MONOLINGUE,DOBLE,A DISTANCIA,GUATEMALA OCCIDENTE
01-10-0259-45,01-622,GUATEMALA,SAN JUAN SACATEPEQUEZ,CENTRO EDUCATIVO PROFESIONAL INTEGRAL (CEPROIN),"ALDEA COMUNIDAD DE RUIZ KM. 36.5, CARRETERA A SAN RAYMUNDO.",47395508,CRISTOBAL DE JESUS SANTIZO ROSALES,NANCY KARINA BAC GUAT,BASICO,PRIVADO,RURAL,ABIERTA,MONOLINGUE,DOBLE,FIN DE SEMANA,GUATEMALA OCCIDENTE
01-10-0260-45,01-622,GUATEMALA,SAN JUAN SACATEPEQUEZ,CENTRO EDUCATIVO PROFESIONAL INTEGRAL (CEPROIN),"ALDEA COMUNIDAD DE RUIZ KM. 36.5, CARRETERA A SAN RAYMUNDO.",47395508,CRISTOBAL DE JESUS SANTIZO ROSALES,NANCY KARINA BAC GUAT,BASICO,PRIVADO,RURAL,ABIERTA,MONOLINGUE,DOBLE,FIN DE SEMANA,GUATEMALA OCCIDENTE
01-10-0263-45,01-610,GUATEMALA,SAN JUAN SACATEPEQUEZ,COLEGIO LA INFANCIA,4A. AVENIDA 5-28 ZONA 3 DE LA VILLA DE SAN JUAN SACATEPEQUEZ,66303910,LESBIA MARICELA COTZOJAY PATZAN,ANA MARÍA GARCÍA ORTIZ,BASICO,PRIVADO,URBANA,ABIERTA,MONOLINGUE,MATUTINA,DIARIO(REGULAR),GUATEMALA OCCIDENTE
01-10-0264-45,01-611,GUATEMALA,SAN JUAN SACATEPEQUEZ,"COLEGIO PRIVADO ""ENRIQUE NOVELLA ALVARADO""","CASERIO LAS TROJES, ALDEA CRUZ BLANCA",66435600,CESAR AUGUSTO LUNA ORTIZ,ASTRID ROCIO LEONARDO FLORES,BASICO,PRIVADO,RURAL,ABIERTA,MONOLINGUE,MATUTINA,DIARIO(REGULAR),GUATEMALA OCCIDENTE
01-10-0267-45,01-636,GUATEMALA,SAN JUAN SACATEPEQUEZ,COLEGIO INTEGRAL MIXTO BELLO AMANECER,"SECTOR IV SECCIÓN ""B"" CASERIO LO DE CARRANZA",47619570,MARIO ALEJANDRO NAJARRO GARCIA SALAS,NORMA FLORIDALMA MUÑOZ PINTO,BASICO,PRIVADO,RURAL,ABIERTA,MONOLINGUE,MATUTINA,DIARIO(REGULAR),GUATEMALA OCCIDENTE
01-10-0276-45,01-639,GUATEMALA,SAN JUAN SACATEPEQUEZ,COLEGIO TECNOLOGICO GUATEMALTECO EDU,8A. AVENIDA 8-05 ZONA 1,57556885,ANDREA VANESSA ALDANA VILLAGRAN DE CASTRO,VERONICA UBEDO CARRILLO,BASICO,PRIVADO,URBANA,ABIERTA,MONOLINGUE,DOBLE,SEMIPRESENCIAL,GUATEMALA OCCIDENTE
01-10-0277-45,01-639,GUATEMALA,SAN JUAN SACATEPEQUEZ,COLEGIO TECNOLOGICO GUATEMALTCO EDU,8A. AVENIDA 8-05 ZONA 1,57556885,ANDREA VANESSA ALDANA VILLAGRAN DE CASTRO,VERONICA UBEDO CARRILLO,BASICO,PRIVADO,URBANA,ABIERTA,MONOLINGUE,DOBLE,SEMIPRESENCIAL,GUATEMALA OCCIDENTE
01-10-1833-45,01-636,GUATEMALA,SAN JUAN SACATEPEQUEZ,IEBC DE ENSEÑANZA,ALDEA LO DE CARRANZA,44004630,MARIO ALEJANDRO NAJARRO GARCIA SALAS,,BASICO,COOPERATIVA,RURAL,ABIERTA,MONOLINGUE,VESPERTINA,DIARIO(REGULAR),GUATEMALA OCCIDENTE
01-10-1834-45,01-610,GUATEMALA,SAN JUAN SACATEPEQUEZ,IEBC DE ENSEÑANZA,ALDEA MONTUFAR,,LESBIA MARICELA COTZOJAY PATZAN,,BASICO,COOPERATIVA,RURAL,ABIERTA,MONOLINGUE,VESPERTINA,DIARIO(REGULAR),GUATEMALA OCCIDENTE
01-10-2173-45,01-636,GUATEMALA,SAN JUAN SACATEPEQUEZ,COLEGIO DE EDUCACION BASICA NUEVOS HORIZONTES II,MANZANA 1 LOTE 16 LA TRINIDAD CIUDAD QUETZAL,40415308,MARIO ALEJANDRO NAJARRO GARCIA SALAS,ADA MILDRED ALEGRÍA MÉNDEZ,BASICO,PRIVADO,RURAL,ABIERTA,MONOLINGUE,MATUTINA,DIARIO(REGULAR),GUATEMALA OCCIDENTE
01-10-2670-45,01-611,GUATEMALA,SAN JUAN SACATEPEQUEZ,INEB REPUBLICA DE AUSTRIA,2A CALLE 7-23 ZONA 2,66302518,CESAR AUGUSTO LUNA ORTIZ,,BASICO,OFICIAL,URBANA,ABIERTA,MONOLINGUE,MATUTINA,DIARIO(REGULAR),GUATEMALA OCCIDENTE
01-10-2672-45,,GUATEMALA,SAN JUAN SACATEPEQUEZ,INSTITUTO PRIVADO MIXTO DE EDUCACION BASICA 'CENTRO CULTURAL ABC',2A CALLE 7-08 ZONA 2,,,,BASICO,PRIVADO,URBANA,CERRADA TEMPORALMENTE,MONOLINGUE,MATUTINA,DIARIO(REGULAR),GUATEMALA OCCIDENTE
01-10-2777-45,01-636,GUATEMALA,SAN JUAN SACATEPEQUEZ,COLEGIO CRISTIANO LA ESTRELLA,COLONIA GRANJAS LA ESTRELLA CASERIO SANJUANERITOS,58567861,MARIO ALEJANDRO NAJARRO GARCIA SALAS,,BASICO,PRIVADO,RURAL,ABIERTA,MONOLINGUE,VESPERTINA,DIARIO(REGULAR),GUATEMALA OCCIDENTE
01-10-2851-45,01-610,GUATEMALA,SAN JUAN SACATEPEQUEZ,COLEGIO MIXTO 'ATENAS',"7A AVENIDA 7-13, ZONA 1",41346708,LESBIA MARICELA COTZOJAY PATZAN,,BASICO,PRIVADO,RURAL,ABIERTA,MONOLINGUE,MATUTINA,DIARIO(REGULAR),GUATEMALA OCCIDENTE
01-10-2960-45,,GUATEMALA,SAN JUAN SACATEPEQUEZ,COLEGIO MIXTO DE EDUCACION BASICA LAS MARGARITAS,"CASA A 1-12, COLONIA LAS MARGARITAS III",,,,BASICO,PRIVADO,URBANA,CERRADA TEMPORALMENTE,MONOLINGUE,MATUTINA,DIARIO(REGULAR),GUATEMALA OCCIDENTE
01-10-3049-45,01-636,GUATEMALA,SAN JUAN SACATEPEQUEZ,INSTITUTO MIXTO BASICO POR COOPERATIVA,"COLONIA CIUDAD QUETZAL, ALDEA LO DE MEJIA. SAN JUAN SACATEPEQUEZ",53530205,MARIO ALEJANDRO NAJARRO GARCIA SALAS,ELMA LUCRECIA SISIMIT CHIPIX,BASICO,COOPERATIVA,RURAL,ABIERTA,MONOLINGUE,VESPERTINA,DIARIO(REGULAR),GUATEMALA OCCIDENTE
01-10-3080-45,,GUATEMALA,SAN JUAN SACATEPEQUEZ,COLEGIO MIXTO DE EDUCACION BASICA 'LICEO FORMACION ESTUDIANTIL',LOTE J 8 A LAS MARGARITAS II,,,,BASICO,PRIVADO,RURAL,CERRADA TEMPORALMENTE,MONOLINGUE,NOCTURNA,DIARIO(REGULAR),GUATEMALA OCCIDENTE
01-10-4204-45,01-636,GUATEMALA,SAN JUAN SACATEPEQUEZ,INSTITUTO PRIVADO EN EDUCACION BASICA CIUDAD QUETZAL,"LOTE 51, MAZANA ""Y"", LOS ENCINOS, CIUDAD QUETZAL",43542063,MARIO ALEJANDRO NAJARRO GARCIA SALAS,GLENDA EUNISSE VELIZ FUENTES,BASICO,PRIVADO,RURAL,ABIERTA,MONOLINGUE,MATUTINA,DIARIO(REGULAR),GUATEMALA OCCIDENTE
01-10-4334-45,,GUATEMALA,SAN JUAN SACATEPEQUEZ,IGER,SAN JUAN SACATEPEQUEZ,,,,BASICO,PRIVADO,URBANA,CERRADA TEMPORALMENTE,MONOLINGUE,MATUTINA,A DISTANCIA,GUATEMALA OCCIDENTE
01-10-6475-45,01-406,GUATEMALA,SAN JUAN SACATEPEQUEZ,LICEO INTEGRAL CIENTIFICO,ALDEA LO DE MEJIA,,MIGUEL ALVARO RODRIGUEZ PORTILLO,,BASICO,PRIVADO,RURAL,CERRADA TEMPORALMENTE,MONOLINGUE,VESPERTINA,FIN DE SEMANA,GUATEMALA OCCIDENTE
01-10-6595-45,01-605,GUATEMALA,SAN JUAN SACATEPEQUEZ,LICEO FORMACION ESTUDIANTIL,LOTE J 8 A LAS MARGARITAS II,55749343,EVERILDA HERNANDEZ MARROQUIN DE LORENZANA,,BASICO,PRIVADO,RURAL,CERRADA TEMPORALMENTE,MONOLINGUE,VESPERTINA,DIARIO(REGULAR),GUATEMALA OCCIDENTE
01-10-7151-45,01-610,GUATEMALA,SAN JUAN SACATEPEQUEZ,COLEGIO 'LA INFANCIA',4A. AVENIDA 5-22 ZONA 3,66302176,LESBIA MARICELA COTZOJAY PATZAN,,BASICO,PRIVADO,URBANA,ABIERTA,MONOLINGUE,VESPERTINA,DIARIO(REGULAR),GUATEMALA OCCIDENTE
01-10-7211-45,01-636,GUATEMALA,SAN JUAN SACATEPEQUEZ,LICEO MIXTO YOSHUA (JESUS SALVADOR),LOTE 93 COLONIA VILLA JUAREZ I LO DE CARRANZA,55104398,MARIO ALEJANDRO NAJARRO GARCIA SALAS,,BASICO,PRIVADO,URBANA,ABIERTA,MONOLINGUE,VESPERTINA,DIARIO(REGULAR),GUATEMALA OCCIDENTE
01-10-7241-45,01-605,GUATEMALA,SAN JUAN SACATEPEQUEZ,COLEGIO MIXTO 'LA FE DE MARIA',LOTE 19 MANZANA A LINDA VISTA I,,EVERILDA HERNANDEZ MARROQUIN DE LORENZANA,,BASICO,PRIVADO,URBANA,CERRADA TEMPORALMENTE,MONOLINGUE,MATUTINA,DIARIO(REGULAR),GUATEMALA OCCIDENTE
01-10-7343-45,01-605,GUATEMALA,SAN JUAN SACATEPEQUEZ,COLEGIO PRIVADO 'VALLE DEL QUETZAL',"LOTE 19 MANZANA D SECTOR II, COLONIA VILLA VERDE CIUDAD QUETZAL","66391458, 57063083",EVERILDA HERNANDEZ MARROQUIN DE LORENZANA,,BASICO,PRIVADO,RURAL,CERRADA TEMPORALMENTE,MONOLINGUE,MATUTINA,DIARIO(REGULAR),GUATEMALA OCCIDENTE
01-10-7344-45,01-401,GUATEMALA,SAN JUAN SACATEPEQUEZ,COLEGIO PRIVADO 'VALLE DEL QUETZAL',"LOTE 19 MANZANA D SECTOR II, COLONIA VILLA VERDE CIUDAD QUETZAL","66391458, 57063083",IXMUCANE ALDANA VILLAVICENCIO,,BASICO,PRIVADO,RURAL,CERRADA TEMPORALMENTE,MONOLINGUE,MATUTINA,FIN DE SEMANA,GUATEMALA OCCIDENTE
01-10-7977-45,01-610,GUATEMALA,SAN JUAN SACATEPEQUEZ,LICEO MIXTO YOSHUA (JESUS SALVADOR),LOTE 39 COLONIA VILLA JUAREZ I LO DE CARRANZA,,LESBIA MARICELA COTZOJAY PATZAN,,BASICO,PRIVADO,RURAL,CERRADA TEMPORALMENTE,MONOLINGUE,VESPERTINA,FIN DE SEMANA,GUATEMALA OCCIDENTE
01-10-8068-45,01-647,GUATEMALA,SAN JUAN SACATEPEQUEZ,COLEGIO CRISTIANO EVANGELICO EFESO,"LOTE 16 MANZANA 22 COLONIA LA TRINIDAD, CIUDAD QUETZAL",55758225,VINICIO ARNOLDO NAJERA CARDONA,LILIAN CAROLINA RAMIREZ CORZO.,BASICO,PRIVADO,RURAL,ABIERTA,MONOLINGUE,MATUTINA,DIARIO(REGULAR),GUATEMALA OCCIDENTE
01-10-8249-45,,GUATEMALA,SAN JUAN SACATEPEQUEZ,COLEGIO LA FE DE MARIA (POR MADUREZ),LOTE 19 MANZANA A COLONIA LINDA VISTA I,52025056,,,BASICO,PRIVADO,RURAL,CERRADA TEMPORALMENTE,MONOLINGUE,DOBLE,FIN DE SEMANA,GUATEMALA OCCIDENTE
01-10-8287-45,01-647,GUATEMALA,SAN JUAN SACATEPEQUEZ,COLEGIO EVANGELICO NUEVO AMANECER,MANZANA 3 LOTE 1 COLONIA LAS ARCADIAS,57682274,VINICIO ARNOLDO NAJERA CARDONA,JUAN FRANCISCO MARTÍNEZ URREA,BASICO,PRIVADO,RURAL,ABIERTA,MONOLINGUE,MATUTINA,DIARIO(REGULAR),GUATEMALA OCCIDENTE
01-10-8684-45,01-605,GUATEMALA,SAN JUAN SACATEPEQUEZ,LICEO CRISITANO 'TRINIDAD',"LOTE 23 MANZANA 3, COLONIA LA TRINIDAD CIUDAD QUETZAL",52186253,EVERILDA HERNANDEZ MARROQUIN DE LORENZANA,,BASICO,PRIVADO,RURAL,CERRADA TEMPORALMENTE,MONOLINGUE,MATUTINA,DIARIO(REGULAR),GUATEMALA OCCIDENTE
01-10-8716-45,01-401,GUATEMALA,SAN JUAN SACATEPEQUEZ,CENTRO EDUCATIVO UTZILAL,MANZANA D LOTE 15 SECTOR I VILLA VERDE CIUDAD QUETZAL,66391240,IXMUCANE ALDANA VILLAVICENCIO,,BASICO,PRIVADO,RURAL,CERRADA TEMPORALMENTE,MONOLINGUE,MATUTINA,FIN DE SEMANA,GUATEMALA OCCIDENTE
01-10-8799-45,01-636,GUATEMALA,SAN JUAN SACATEPEQUEZ,LICEO CRISTIANO FUENTES DE LUZ,"MANZANA NO.41 LOTES 26 Y 27, LAS FUENTES CIUDAD QUETZAL",42673817,MARIO ALEJANDRO NAJARRO GARCIA SALAS,,BASICO,PRIVADO,RURAL,ABIERTA,MONOLINGUE,VESPERTINA,DIARIO(REGULAR),GUATEMALA OCCIDENTE
01-10-8828-45,01-401,GUATEMALA,SAN JUAN SACATEPEQUEZ,"LICEO ""TECNOLOGICO BAUTISTA""","GRANJA 2 Y 3, MANZANA 6 , COLONIA LA ESTRELLA, CIUDAD QUETZAL",53070705,IXMUCANE ALDANA VILLAVICENCIO,OSCAR RODOLFO GARZA GARCIA,BASICO,PRIVADO,URBANA,CERRADA TEMPORALMENTE,MONOLINGUE,DOBLE,FIN DE SEMANA,GUATEMALA OCCIDENTE
01-10-8881-45,01-636,GUATEMALA,SAN JUAN SACATEPEQUEZ,IEBC ADONAI,COLONIA VILLA VERDE,51072380,MARIO ALEJANDRO NAJARRO GARCIA SALAS,,BASICO,COOPERATIVA,RURAL,ABIERTA,MONOLINGUE,VESPERTINA,DIARIO(REGULAR),GUATEMALA OCCIDENTE
01-10-8987-45,01-605,GUATEMALA,SAN JUAN SACATEPEQUEZ,LICEO MIXTO CANTAR DE LOS CANTARES II,LOTE 1 MANZANA N RESIDENCIALES EL QUETZAL,66376063,EVERILDA HERNANDEZ MARROQUIN DE LORENZANA,,BASICO,PRIVADO,URBANA,CERRADA TEMPORALMENTE,MONOLINGUE,MATUTINA,DIARIO(REGULAR),GUATEMALA OCCIDENTE
01-10-9015-45,01-636,GUATEMALA,SAN JUAN SACATEPEQUEZ,COLEGIO MIXTO JARDINES DE SAN GABRIEL,"SECTOR B ,CASAS 7 Y 8, CONDOMINIO JARDINES DE SAN GABRIEL CARRETERA A CIUD AD QUETZAL KM. 22.5",24504007,MARIO ALEJANDRO NAJARRO GARCIA SALAS,,BASICO,PRIVADO,URBANA,CERRADA TEMPORALMENTE,MONOLINGUE,VESPERTINA,DIARIO(REGULAR),GUATEMALA OCCIDENTE
01-10-9035-45,01-401,GUATEMALA,SAN JUAN SACATEPEQUEZ,INSTITUTO PRIVADO DE EDUCACION BASICA CIUDAD QUETZAL (POR MADUREZ),LOTIFICACION LAS FUENTES CIUDAD QUETZAL,55137300,IXMUCANE ALDANA VILLAVICENCIO,,BASICO,PRIVADO,URBANA,CERRADA TEMPORALMENTE,MONOLINGUE,MATUTINA,FIN DE SEMANA,GUATEMALA OCCIDENTE
01-10-9189-45,01-611,GUATEMALA,SAN JUAN SACATEPEQUEZ,IEBC DE ENSEÑANZA,ALDEA SACSUY,52752007,CESAR AUGUSTO LUNA ORTIZ,,BASICO,COOPERATIVA,RURAL,ABIERTA,MONOLINGUE,VESPERTINA,DIARIO(REGULAR),GUATEMALA OCCIDENTE
01-10-9427-45,01-610,GUATEMALA,SAN JUAN SACATEPEQUEZ,COLEGIO TEMATICO INTEGRAL,"8A. AVENIDA 3-07, ZONA 2",66302046,LESBIA MARICELA COTZOJAY PATZAN,FRANCISCO BOROR PIRIR,BASICO,PRIVADO,URBANA,ABIERTA,MONOLINGUE,MATUTINA,DIARIO(REGULAR),GUATEMALA OCCIDENTE
01-10-9462-45,01-639,GUATEMALA,SAN JUAN SACATEPEQUEZ,NUCLEO FAMILIAR EDUCATIVO PARA EL DESARROLLO NUFED,LOTE 88 COLONIA LA ECONOMICA,55110900,ANDREA VANESSA ALDANA VILLAGRAN DE CASTRO,,BASICO,OFICIAL,RURAL,ABIERTA,MONOLINGUE,MATUTINA,DIARIO(REGULAR),GUATEMALA OCCIDENTE
01-10-9493-45,01-610,GUATEMALA,SAN JUAN SACATEPEQUEZ,COLEGIO MIXTO CREARTE,9A. AVENIDA 7-07 ZONA 1,52216316,LESBIA MARICELA COTZOJAY PATZAN,,BASICO,PRIVADO,URBANA,CERRADA TEMPORALMENTE,MONOLINGUE,VESPERTINA,DIARIO(REGULAR),GUATEMALA OCCIDENTE
01-10-9521-45,01-639,GUATEMALA,SAN JUAN SACATEPEQUEZ,NUCLEO FAMILIAR EDUCATIVO PARA EL DESARROLLO NUFED,CASERIO LO DE CARRANZA ALDEA LO DE MEJIA,59300284,ANDREA VANESSA ALDANA VILLAGRAN DE CASTRO,,BASICO,OFICIAL,RURAL,CERRADA TEMPORALMENTE,MONOLINGUE,DOBLE,DIARIO(REGULAR),GUATEMALA OCCIDENTE
01-10-9522-45,01-639,GUATEMALA,SAN JUAN SACATEPEQUEZ,NUCLEO FAMILIAR EDUCATIVO PARA EL DESARROLLO NUFED,ALDEA LO DE MEJIA,54144450,ANDREA VANESSA ALDANA VILLAGRAN DE CASTRO,FREDDY CARLOS CONCOHÁ NOJ,BASICO,OFICIAL,RURAL,ABIERTA,MONOLINGUE,DOBLE,DIARIO(REGULAR),GUATEMALA OCCIDENTE
01-10-9543-45,01-410,GUATEMALA,SAN JUAN SACATEPEQUEZ,CENTRO DE COMPUTACION CEI-PC,"LOTE 19, MANZANA A , LINDA VISTA I",34489144,CEDWIN EUGENIO CRUZ BUCARO,,BASICO,PRIVADO,RURAL,ABIERTA,MONOLINGUE,DOBLE,FIN DE SEMANA,GUATEMALA OCCIDENTE
01-10-9544-45,01-410,GUATEMALA,SAN JUAN SACATEPEQUEZ,CENTRO DE COMPUTACION CEI-PC,"LOTE 19, MANZANA A , LINDA VISTA I",52159572,CEDWIN EUGENIO CRUZ BUCARO,,BASICO,PRIVADO,RURAL,ABIERTA,MONOLINGUE,DOBLE,FIN DE SEMANA,GUATEMALA OCCIDENTE
01-10-9641-45,01-409,GUATEMALA,SAN JUAN SACATEPEQUEZ,LICEO CIENTIFICO SAN JUAN BAUTISTA,5A. AVENIDA 2-05 ZONA 3,66302176,DELMY CONSUELO GARCIA DONIS DE GOMEZ,,BASICO,PRIVADO,URBANA,ABIERTA,MONOLINGUE,DOBLE,FIN DE SEMANA,GUATEMALA OCCIDENTE
01-10-9643-45,01-409,GUATEMALA,SAN JUAN SACATEPEQUEZ,LICEO CIENTIFICO SAN JUAN BAUTISTA,5A. AVENIDA 2-05 ZONA 3,34691697,DELMY CONSUELO GARCIA DONIS DE GOMEZ,,BASICO,PRIVADO,URBANA,ABIERTA,MONOLINGUE,DOBLE,FIN DE SEMANA,GUATEMALA OCCIDENTE
01-10-9710-45,01-622,GUATEMALA,SAN JUAN SACATEPEQUEZ,COLEGIO MIXTO CREARTE,4TA CALLE 8-25 ZONA 2,66302070,CRISTOBAL DE JESUS SANTIZO ROSALES,VERONICA AYDEE ROQUE MORALES,BASICO,PRIVADO,URBANA,ABIERTA,MONOLINGUE,MATUTINA,DIARIO(REGULAR),GUATEMALA OCCIDENTE
01-10-9716-45,01-636,GUATEMALA,SAN JUAN SACATEPEQUEZ,CENTRO EDUCATIVO LAS FLORES II,KM. 22.5 CARRETERA A CIUDAD QUETZAL CASA C-16 COLONIA LAS MARGARITAS VII,66376153,MARIO ALEJANDRO NAJARRO GARCIA SALAS,,BASICO,PRIVADO,URBANA,ABIERTA,MONOLINGUE,MATUTINA,DIARIO(REGULAR),GUATEMALA OCCIDENTE
01-10-9733-45,01-410,GUATEMALA,SAN JUAN SACATEPEQUEZ,COLEGIO MIXTO ATENAS,"5TA. AVENIDA 6-13, ZONA 3",66303941,CEDWIN EUGENIO CRUZ BUCARO,,BASICO,PRIVADO,URBANA,ABIERTA,MONOLINGUE,DOBLE,FIN DE SEMANA,GUATEMALA OCCIDENTE
01-10-9739-45,01-622,GUATEMALA,SAN JUAN SACATEPEQUEZ,CENTRO EDUCATIVO 'OPORTUNIDAD PARA LOS NIÑOS Y EL ARTESANO 3000',"CALLE DE LA ESCUELA POLITECNICA, LOTE NO.55 ALDEA LA COMUNIDAD DE RUIZ",66303915,CRISTOBAL DE JESUS SANTIZO ROSALES,LILIANA DEL ROSARIO ALVAREZ,BASICO,PRIVADO,RURAL,ABIERTA,MONOLINGUE,MATUTINA,DIARIO(REGULAR),GUATEMALA OCCIDENTE
01-10-9838-45,01-610,GUATEMALA,SAN JUAN SACATEPEQUEZ,INSTITUTO BASICO POR COOPERATIVA DE SAJCAVILLA,ALDEA SAJCAVILLA,66304191,LESBIA MARICELA COTZOJAY PATZAN,JUAN RENE UZ GARCIA,BASICO,COOPERATIVA,RURAL,ABIERTA,MONOLINGUE,VESPERTINA,DIARIO(REGULAR),GUATEMALA OCCIDENTE
01-11-0004-45,01-613,GUATEMALA,SAN RAYMUNDO,INSTITUTO MIXTO DE EDUCACION BASICA POR COOPERATIVA ESTANCIA DE LA VIRGEN,ALDEA ESTANCIA DE LA VIRGEN,53001417,RONY ESTUARDO AREVALO CASTILLO,----,BASICO,COOPERATIVA,RURAL,ABIERTA,MONOLINGUE,VESPERTINA,DIARIO(REGULAR),GUATEMALA OCCIDENTE
01-11-0005-45,01-613,GUATEMALA,SAN RAYMUNDO,INEB,ALDEA ESTANCIA VIEJA,42061987,RONY ESTUARDO AREVALO CASTILLO,---,BASICO,OFICIAL,RURAL,CERRADA TEMPORALMENTE,MONOLINGUE,VESPERTINA,DIARIO(REGULAR),GUATEMALA OCCIDENTE
01-11-0006-45,01-613,GUATEMALA,SAN RAYMUNDO,INEB,ALDEA PAMOCÁ,47694360,RONY ESTUARDO AREVALO CASTILLO,---,BASICO,OFICIAL,RURAL,ABIERTA,MONOLINGUE,VESPERTINA,DIARIO(REGULAR),GUATEMALA OCCIDENTE
01-11-0008-45,01-613,GUATEMALA,SAN RAYMUNDO,INEB DE TELESECUNDARIA,ALDEA LABOR VIEJA,55788899,RONY ESTUARDO AREVALO CASTILLO,---,BASICO,OFICIAL,RURAL,ABIERTA,MONOLINGUE,VESPERTINA,DIARIO(REGULAR),GUATEMALA OCCIDENTE
01-11-0009-45,01-613,GUATEMALA,SAN RAYMUNDO,INEB DE TELESECUNDARIA,ALDEA EL ZARZAL,,RONY ESTUARDO AREVALO CASTILLO,---,BASICO,OFICIAL,RURAL,ABIERTA,MONOLINGUE,VESPERTINA,DIARIO(REGULAR),GUATEMALA OCCIDENTE
01-11-0010-45,01-613,GUATEMALA,SAN RAYMUNDO,INEB DE TELESECUNDARIA,ALDEA LA CIENAGA,58772214,RONY ESTUARDO AREVALO CASTILLO,---,BASICO,OFICIAL,RURAL,ABIERTA,MONOLINGUE,VESPERTINA,DIARIO(REGULAR),GUATEMALA OCCIDENTE
01-11-0011-45,01-613,GUATEMALA,SAN RAYMUNDO,INEB DE TELESECUNDARIA,ALDEA EL CARRIZAL,42290603,RONY ESTUARDO AREVALO CASTILLO,---,BASICO,OFICIAL,RURAL,ABIERTA,MONOLINGUE,VESPERTINA,DIARIO(REGULAR),GUATEMALA OCCIDENTE
01-11-0014-45,01-613,GUATEMALA,SAN RAYMUNDO,INEB DE TELESECUNDARIA,CASERIO CONCEPCION EL CIPRES,,RONY ESTUARDO AREVALO CASTILLO,---,BASICO,OFICIAL,RURAL,ABIERTA,MONOLINGUE,VESPERTINA,DIARIO(REGULAR),GUATEMALA OCCIDENTE
01-11-0015-45,01-410,GUATEMALA,SAN RAYMUNDO,COLEGIO EVANGELICO BELEN,3A. AVENIDA 6-20 ZONA 1,66308985,CEDWIN EUGENIO CRUZ BUCARO,CELSO HUGO CHAVAL AYAPAN,BASICO,PRIVADO,URBANA,ABIERTA,MONOLINGUE,DOBLE,FIN DE SEMANA,GUATEMALA OCCIDENTE
01-11-0016-45,01-410,GUATEMALA,SAN RAYMUNDO,COLEGIO EVANGELICO BELEN,3A. AVENIDA 6-20 ZONA 1,66308985,CEDWIN EUGENIO CRUZ BUCARO,CELSO HUGO CHAVAL AYAPAN,BASICO,PRIVADO,URBANA,ABIERTA,MONOLINGUE,DOBLE,FIN DE SEMANA,GUATEMALA OCCIDENTE
01-11-0023-45,01-613,GUATEMALA,SAN RAYMUNDO,COLEGIO CRISTIANO MAÑANA GLORIOSA,ALDEA LLANO DE LA VIRGEN,51663394,RONY ESTUARDO AREVALO CASTILLO,WILNER HARMODIO AVALOS PEREZ,BASICO,PRIVADO,RURAL,ABIERTA,MONOLINGUE,MATUTINA,DIARIO(REGULAR),GUATEMALA OCCIDENTE
01-11-0032-45,01-613,GUATEMALA,SAN RAYMUNDO,INEB,ALDEA LLANO DE LA VIRGEN,46878187,RONY ESTUARDO AREVALO CASTILLO,RUTH NOHEMI HERNANDEZ MARTINEZ,BASICO,OFICIAL,RURAL,ABIERTA,MONOLINGUE,VESPERTINA,DIARIO(REGULAR),GUATEMALA OCCIDENTE
01-11-0040-45,01-613,GUATEMALA,SAN RAYMUNDO,CORNERSTONE INTERNATIONAL SCHOOL,9A. AVENIDA 2-82 ZONA 2,66308223,RONY ESTUARDO AREVALO CASTILLO,NIDIAN SILVANA GUZMÁN PATZÁN,BASICO,PRIVADO,URBANA,ABIERTA,MONOLINGUE,MATUTINA,DIARIO(REGULAR),GUATEMALA OCCIDENTE
01-11-0044-45,01-613,GUATEMALA,SAN RAYMUNDO,COLEGIO MIXTO EL JARDÍN,1RA. CALLE 7-16 ZONA 2,66308764,RONY ESTUARDO AREVALO CASTILLO,CARMEN ELIZABETH VARGAS GONZÁLEZ,BASICO,PRIVADO,URBANA,ABIERTA,MONOLINGUE,VESPERTINA,DIARIO(REGULAR),GUATEMALA OCCIDENTE
01-11-0047-45,01-613,GUATEMALA,SAN RAYMUNDO,CENTRO EDUCATIVO CRISTIANO JESÚS VIENE,"SECTOR 1, 2-52 COLONIA NUEVA JERUSALEM ZONA 6",32162971,RONY ESTUARDO AREVALO CASTILLO,NIVIAN BELEN TURUY CAMEY,BASICO,PRIVADO,URBANA,ABIERTA,MONOLINGUE,VESPERTINA,DIARIO(REGULAR),GUATEMALA OCCIDENTE
01-11-0049-45,01-410,GUATEMALA,SAN RAYMUNDO,LICEO CENTROAMERICANO,10 CALLE 6-51 ZONA 1,46338808,CEDWIN EUGENIO CRUZ BUCARO,FERNANDO BERNAVE AGUILAR CASTILLO,BASICO,PRIVADO,URBANA,ABIERTA,MONOLINGUE,DOBLE,FIN DE SEMANA,GUATEMALA OCCIDENTE
01-11-2678-45,01-613,GUATEMALA,SAN RAYMUNDO,INSTITUTO PRIVADO MIXTO DE EDUCACION BASICA 'COLEGIO SAN RAYMUNDO',2A AV 9-35 ZONA 1,59929038,RONY ESTUARDO AREVALO CASTILLO,,BASICO,PRIVADO,URBANA,CERRADA TEMPORALMENTE,MONOLINGUE,VESPERTINA,DIARIO(REGULAR),GUATEMALA OCCIDENTE
01-11-2679-45,01-613,GUATEMALA,SAN RAYMUNDO,INSTITUTO NACIONAL MIXTO DE EDUCACION BASICA,5A. CALLE FINAL 7-80 ZONA 2,66308852,RONY ESTUARDO AREVALO CASTILLO,HECTOR HUGO LOPEZ VELASQUEZ,BASICO,OFICIAL,URBANA,ABIERTA,MONOLINGUE,MATUTINA,DIARIO(REGULAR),GUATEMALA OCCIDENTE
01-11-4337-45,,GUATEMALA,SAN RAYMUNDO,IGER,SAN RAYMUNDO,,,,BASICO,PRIVADO,URBANA,CERRADA TEMPORALMENTE,MONOLINGUE,MATUTINA,A DISTANCIA,GUATEMALA OCCIDENTE
01-11-7601-45,01-613,GUATEMALA,SAN RAYMUNDO,INEB DE TELESECUNDARIA,ALDEA VUELTA GRANDE,31773120,RONY ESTUARDO AREVALO CASTILLO,,BASICO,OFICIAL,RURAL,ABIERTA,MONOLINGUE,MATUTINA,DIARIO(REGULAR),GUATEMALA OCCIDENTE
01-11-9113-45,01-613,GUATEMALA,SAN RAYMUNDO,LICEO'CENTROAMERICANO',10A. CALLE 6-51 ZONA 1,66308982,RONY ESTUARDO AREVALO CASTILLO,,BASICO,PRIVADO,URBANA,ABIERTA,MONOLINGUE,MATUTINA,DIARIO(REGULAR),GUATEMALA OCCIDENTE
01-11-9115-45,01-410,GUATEMALA,SAN RAYMUNDO,LICEO CENTROAMERICANO,10. CALLE 6-51 ZONA 1,66308982,CEDWIN EUGENIO CRUZ BUCARO,FERNANDO BERNAVE AGUILAR CASTILLO,BASICO,PRIVADO,URBANA,ABIERTA,MONOLINGUE,DOBLE,FIN DE SEMANA,GUATEMALA OCCIDENTE
01-11-9240-45,01-613,GUATEMALA,SAN RAYMUNDO,INSTITUTO DE EDUCACION BASICA POR COOPERATIVA 'SAN RAYMUNDO',5A CALLE FINAL 7-80 ZONA 2,,RONY ESTUARDO AREVALO CASTILLO,,BASICO,COOPERATIVA,URBANA,CERRADA TEMPORALMENTE,MONOLINGUE,VESPERTINA,DIARIO(REGULAR),GUATEMALA OCCIDENTE
01-11-9520-45,01-613,GUATEMALA,SAN RAYMUNDO,COLEGIO EVANGELICO BELEN,3A. AVENIDA 6-20 ZONA 1,66308985,RONY ESTUARDO AREVALO CASTILLO,,BASICO,PRIVADO,URBANA,ABIERTA,MONOLINGUE,VESPERTINA,DIARIO(REGULAR),GUATEMALA OCCIDENTE
01-12-0005-45,01-614,GUATEMALA,CHUARRANCHO,INEB,CANTON CENTRAL,31121234,JERVIN ARSENIO FIGUEROA DUBON,---,BASICO,OFICIAL,URBANA,ABIERTA,MONOLINGUE,VESPERTINA,DIARIO(REGULAR),GUATEMALA NORTE
01-12-0007-45,01-614,GUATEMALA,CHUARRANCHO,INEB DE TELESECUNDARIA,ALDEA SAN BUENA VENTURA,50413901,JERVIN ARSENIO FIGUEROA DUBON,---,BASICO,OFICIAL,RURAL,ABIERTA,MONOLINGUE,VESPERTINA,DIARIO(REGULAR),GUATEMALA NORTE
