CODIGO,DISTRITO,DEPARTAMENTO,MUNICIPIO,ESTABLECIMIENTO,DIRECCION,TELEFONO,SUPERVISOR,DIRECTOR,NIVEL,SECTOR,AREA,STATUS,MODALIDAD,JORNADA,PLAN,DEPARTAMENTAL
01-15-2727-45,01-213,GUATEMALA,VILLA NUEVA,CENTRO EDUCATIVO MADELIN,5A. AVENIDA Y 5A. CALLE ESQUINA ZONA 5,66600356,LILIANA LETICIA DUBON ESPINOZA,,BASICO,PRIVADO,URBANA,CERRADA TEMPORALMENTE,MONOLINGUE,VESPERTINA,DIARIO(REGULAR),GUATEMALA SUR
01-15-2732-45,,GUATEMALA,VILLA NUEVA,INSTITUTO PRIVADO MIXTO DE EDUCACION BASICA 'COLEGIO RAFAEL ALVAREZ OVALLE',CALLE RIO MADEIRA # 68 CIUDAD PERONIA,,,,BASICO,PRIVADO,URBANA,CERRADA TEMPORALMENTE,MONOLINGUE,VESPERTINA,DIARIO(REGULAR),GUATEMALA SUR
01-15-2735-45,01-216,GUATEMALA,VILLA NUEVA,COLEGIO PARTICULAR MIXTO LA ENSEÑANZA,3A. AVENIDA 2-86 ZONA 4 COLONIA ETERNA PRIMAVERA,66312150,GLADYS IDALMA CHAVARRIA NIJ,SERGIO ANIBAL ARGUETA ESTRADA,BASICO,PRIVADO,URBANA,ABIERTA,MONOLINGUE,MATUTINA,DIARIO(REGULAR),GUATEMALA SUR
01-15-2736-45,01-409,GUATEMALA,VILLA NUEVA,INSTITUTO PRIVADO MIXTO DE EDUCACION BASICA 'COLEGIO NUEVA ENSEÑANZA',LOTE 210 SECTOR 'A' ASENTAMIENTO LA ESPERANZA COLONIA EL MEZQUITAL ZONA 12,24804683,DELMY CONSUELO GARCIA DONIS DE GOMEZ,,BASICO,PRIVADO,URBANA,CERRADA TEMPORALMENTE,MONOLINGUE,NOCTURNA,DIARIO(REGULAR),GUATEMALA SUR
01-15-2738-45,,GUATEMALA,VILLA NUEVA,INSTITUTO PRIVADO MIXTO DE EDUCACION BASICA 'COLEGIO VALLE DEL SOL',4A CALLE 10-69 ZONA 1,66360428,,,BASICO,PRIVADO,URBANA,CERRADA TEMPORALMENTE,MONOLINGUE,NOCTURNA,DIARIO(REGULAR),GUATEMALA SUR
01-15-2739-45,01-214,GUATEMALA,VILLA NUEVA,INEB COLONIA LINDA VISTA,"14 AVENIDA 5-26 ZONA 4 COLONIA LINDA VISTA,",66306037,HECTOR RAUL ESCUN VIDES,CLAUDIA MARINA MARTINEZ ARGUETA,BASICO,OFICIAL,URBANA,ABIERTA,MONOLINGUE,VESPERTINA,DIARIO(REGULAR),GUATEMALA SUR
01-15-2740-45,01-218,GUATEMALA,VILLA NUEVA,INSTITUTO DE EDUCACION BASICA POR COOPERATIVA'SOLIDARIDAD',3A. AV. 7-69 ZONA 8 CIUDAD PERONIA VILLA NUEVA,24786098,BENIGNO ISAIAS DE LEON OROZCO,,BASICO,COOPERATIVA,URBANA,ABIERTA,MONOLINGUE,VESPERTINA,DIARIO(REGULAR),GUATEMALA SUR
01-15-2742-45,,GUATEMALA,VILLA NUEVA,INSTITUTO PRIVADO MIXTO DE EDUCACION BASICA 'COLEGIO AMERICA CENTRAL',6A AV 2-88 CIUDAD REAL I ZONA 12,,,,BASICO,PRIVADO,URBANA,CERRADA TEMPORALMENTE,MONOLINGUE,NOCTURNA,DIARIO(REGULAR),GUATEMALA SUR
01-15-2883-45,01-219,GUATEMALA,VILLA NUEVA,CENTRO CULTURAL AVE MARIA DE LA ASUNCION,"LOTE 33, RESIDENCIALES LA SELVA, CIDUAD SAN CRISTOBAL, ZONA 8",24786391,FLOR DE MARIA HERNANDEZ MOLINA,JULIO RODOLFO GUERRA GUTIERREZ,BASICO,PRIVADO,URBANA,ABIERTA,MONOLINGUE,MATUTINA,DIARIO(REGULAR),GUATEMALA SUR
01-15-2885-45,01-413,GUATEMALA,VILLA NUEVA,INSTITUTO PRIVADO GUATEMALA DE LA ASUNCION,6A. AV. 3-54 ZONA 1,66311815,AMARILIS RIVAS MEJIA DE DIAZ,,BASICO,PRIVADO,URBANA,CERRADA TEMPORALMENTE,MONOLINGUE,NOCTURNA,DIARIO(REGULAR),GUATEMALA SUR
01-15-2886-45,01-216,GUATEMALA,VILLA NUEVA,COLEGIO MIXTO MARTA MARIA,3A. CALLE 9-98 ZONA 1,66310065,GLADYS IDALMA CHAVARRIA NIJ,ARELIS YOJANA GODINEZ MENDEZ,BASICO,PRIVADO,URBANA,ABIERTA,MONOLINGUE,MATUTINA,DIARIO(REGULAR),GUATEMALA SUR
01-15-3040-45,01-213,GUATEMALA,VILLA NUEVA,CENTRO CRISTIANO EDUCACIONAL VIDA S.A.,"10 AVENIDA A 8-73, ZONA 6, RESIDENCIALES CATALINA",66592215,LILIANA LETICIA DUBON ESPINOZA,,BASICO,PRIVADO,URBANA,ABIERTA,MONOLINGUE,MATUTINA,DIARIO(REGULAR),GUATEMALA SUR
01-15-3041-45,01-219,GUATEMALA,VILLA NUEVA,COLEGIO MIXTO EVANGELICO 'EL BUEN SEMBRADOR',"CALLE RIO EUFRATES No 31. CIUDAD PERONIA, VILLA NUEVA, GUATEMALA",53155360,FLOR DE MARIA HERNANDEZ MOLINA,,BASICO,PRIVADO,URBANA,CERRADA TEMPORALMENTE,MONOLINGUE,VESPERTINA,DIARIO(REGULAR),GUATEMALA SUR
01-15-3042-45,,GUATEMALA,VILLA NUEVA,"CENTRO DE ESTUDIOS DE INFORMATICA, COMPUTACION Y TECNOLOGIA",1 CALLE 5-89 ZONA 6 VILLA NUEVA,,,,BASICO,PRIVADO,URBANA,CERRADA TEMPORALMENTE,MONOLINGUE,NOCTURNA,DIARIO(REGULAR),GUATEMALA SUR
01-15-3043-45,01-212,GUATEMALA,VILLA NUEVA,"CENTRO DE ESTUDIOS DE INFORMATICA, COMPUTACION Y TECNOLOGIA","9A. AVENIDA A 1-32, ZONA 1",66365889,HAROLDO ENRIQUE NAVAS PAZ,ESTER NOEMÍ JUAREZ MENDEZ DE CONCOGUA,BASICO,PRIVADO,URBANA,ABIERTA,MONOLINGUE,MATUTINA,DIARIO(REGULAR),GUATEMALA SUR
01-15-3090-45,01-411,GUATEMALA,VILLA NUEVA,COLEGIO 'LICEO MARQUENSE',"13 AVENIDA 22-55 ZONA 12, COLONIA VILLA LOBOS I",54555951,JUAN ENRIQUE MARTINEZ SOLANO,AXEL FENRIS ZAVALA RAMOS,BASICO,PRIVADO,URBANA,ABIERTA,MONOLINGUE,NOCTURNA,DIARIO(REGULAR),GUATEMALA SUR
01-15-3091-45,,GUATEMALA,VILLA NUEVA,COLEGIO EVANGELICO MIXTO NOCTURNO 'NUEVA ESPERANZA',"LOTE 210, SECTOR 'A' ASENTAMIENTO LA ESPERANZA, COLONIA EL MEZQUITAL.",,,,BASICO,PRIVADO,URBANA,CERRADA TEMPORALMENTE,MONOLINGUE,NOCTURNA,DIARIO(REGULAR),GUATEMALA SUR
01-15-3097-45,01-406,GUATEMALA,VILLA NUEVA,INSTITUTO 'JUVENTUD NUEVA',"1A. AV. ENTRE 5A. Y 6A. CALLE ZONA 12, COLONIA EL MEZQUITAL",24772076,MIGUEL ALVARO RODRIGUEZ PORTILLO,,BASICO,PRIVADO,URBANA,CERRADA TEMPORALMENTE,MONOLINGUE,NOCTURNA,DIARIO(REGULAR),GUATEMALA SUR
01-15-4154-45,,GUATEMALA,VILLA NUEVA,INSTITUTO MIXTO PRIVADO 'GUATEMALA DE LA ASUNCION',"4A. CALLE 6-91 ZONA 1, VILLA NUEVA",,,,BASICO,PRIVADO,URBANA,CERRADA TEMPORALMENTE,MONOLINGUE,VESPERTINA,DIARIO(REGULAR),GUATEMALA SUR
01-15-4341-45,,GUATEMALA,VILLA NUEVA,IGER,VILLA NUEVA,,,,BASICO,PRIVADO,URBANA,CERRADA TEMPORALMENTE,MONOLINGUE,MATUTINA,A DISTANCIA,GUATEMALA SUR
01-15-4423-45,01-206,GUATEMALA,VILLA NUEVA,COLEGIO PARTICULAR MIXTO DIOS DE ISRAEL,"5 AVE 7-48 ZONA 12,COLONIA MEZQUITAL",43621630,INGRID ELIZABETH PEÑA TRUJILLO,MARIA SOFIA PINEDA CACEROS,BASICO,PRIVADO,URBANA,ABIERTA,MONOLINGUE,VESPERTINA,DIARIO(REGULAR),GUATEMALA SUR
01-15-4425-45,01-212,GUATEMALA,VILLA NUEVA,COLEGIO RAFAEL AREVALO MARTINEZ,7A AVE 7-55 ZONA 3 ALDEA BARCENA,66293423,HAROLDO ENRIQUE NAVAS PAZ,OTTO DAVID GUAMUCH TUBAC,BASICO,PRIVADO,RURAL,ABIERTA,MONOLINGUE,MATUTINA,DIARIO(REGULAR),GUATEMALA SUR
01-15-6150-45,01-213,GUATEMALA,VILLA NUEVA,LICEO MIXTO EN COMPUTACION MIRALVALLE,1A. AVENIDA A 2-09 ZONA 2 SAN JOSE VILLA NUEVA,,LILIANA LETICIA DUBON ESPINOZA,,BASICO,PRIVADO,RURAL,ABIERTA,MONOLINGUE,VESPERTINA,DIARIO(REGULAR),GUATEMALA SUR
01-15-6190-45,01-218,GUATEMALA,VILLA NUEVA,INSTITUTO MIXTO DE EDUCACION BASICA POR COOPERATIVA DE ENSEÑANZA,"12 AVENIDA 2-32 ZONA 3, BARCENA",66295395,BENIGNO ISAIAS DE LEON OROZCO,ROSA ADELAIDA TORIBIO PERDOMO DE LÓPEZ,BASICO,COOPERATIVA,RURAL,ABIERTA,MONOLINGUE,VESPERTINA,DIARIO(REGULAR),GUATEMALA SUR
01-15-6192-45,01-214,GUATEMALA,VILLA NUEVA,COLEGIO 'PRADOS SONORA',"0 AVENIDA 'B' 0-93, ZONA 4, RESIDENCIAL PRADOS SONORA",66360856,HECTOR RAUL ESCUN VIDES,,BASICO,PRIVADO,URBANA,CERRADA TEMPORALMENTE,MONOLINGUE,MATUTINA,DIARIO(REGULAR),GUATEMALA SUR
01-15-6196-45,,GUATEMALA,VILLA NUEVA,INSTITUTO PRIVADO MIXTO DE EDUCACION BASICA Y BACHILLERATO EN CIENCIAS Y LETRAS POR MADUREZ,9AV. A 1-22 ZONA 1,,,,BASICO,PRIVADO,URBANA,CERRADA TEMPORALMENTE,MONOLINGUE,VESPERTINA,SABATINO,GUATEMALA SUR
01-15-6197-45,01-411,GUATEMALA,VILLA NUEVA,COLEGIO LICEO MARQUENSE,"13 AVENIDA 22-55 ZONA 12, COLONIA VILLA LOBOS I",54555951,JUAN ENRIQUE MARTINEZ SOLANO,AXEL FENRIS ZAVALA RAMOS,BASICO,PRIVADO,URBANA,ABIERTA,MONOLINGUE,VESPERTINA,FIN DE SEMANA,GUATEMALA SUR
01-15-6247-45,01-218,GUATEMALA,VILLA NUEVA,INSTITUTO DE EDUCACION BASICA POR COOPERATIVA CIUDAD DEL SOL,5A. CALLE 9-02 ZONA 4 COLONIA DEL SOL,54704932,BENIGNO ISAIAS DE LEON OROZCO,,BASICO,COOPERATIVA,URBANA,ABIERTA,MONOLINGUE,VESPERTINA,DIARIO(REGULAR),GUATEMALA SUR
01-15-6249-45,01-219,GUATEMALA,VILLA NUEVA,COLEGIO EVANGELICO GALILEA,7AV. 5-13 FINAL DE TERRAZAS II ZONA 8,24787335,FLOR DE MARIA HERNANDEZ MOLINA,MARIA DEL SOCORRO GAITAN LARA DE ROSALES,BASICO,PRIVADO,URBANA,ABIERTA,MONOLINGUE,MATUTINA,DIARIO(REGULAR),GUATEMALA SUR
01-15-6264-45,01-207,GUATEMALA,VILLA NUEVA,CENTRO EDUCATIVO FE Y ALEGRIA NO. 14,"1A. CALLE FINAL 6-95 ASENTAMIENTO LA ESPERANZA Z.12,COLONIA EL MEZQUITAL",51378935,LUZ ANTONIA POCON CARRILLO,ESGAR AMILCAR LUCH CANEL,BASICO,PRIVADO,URBANA,ABIERTA,MONOLINGUE,VESPERTINA,DIARIO(REGULAR),GUATEMALA SUR
01-15-6265-45,01-207,GUATEMALA,VILLA NUEVA,CENTRO EDUCATIVO FE Y ALEGRIA NO. 14,1A. CALLE FINAL 6-95 ASENTAMIENTO LA ESPERANZA Z.12 COLONIA EL MEZQUITAL.,51378935,LUZ ANTONIA POCON CARRILLO,ESGAR AMILCAR LUCH CANEL,BASICO,PRIVADO,URBANA,ABIERTA,MONOLINGUE,MATUTINA,DIARIO(REGULAR),GUATEMALA SUR
01-15-6508-45,01-214,GUATEMALA,VILLA NUEVA,LICEO MIXTO ORIENTAL GUATEMALTECO,9A. CALLE 5AV. LOTE 61 ZONA 2 SAN JOSE VILLA NUEVA,,HECTOR RAUL ESCUN VIDES,,BASICO,PRIVADO,RURAL,CERRADA TEMPORALMENTE,MONOLINGUE,VESPERTINA,DIARIO(REGULAR),GUATEMALA SUR
01-15-6509-45,01-215,GUATEMALA,VILLA NUEVA,LICEO CRISTIANO PEDAGOGICO,5TA CALLE 3-22 ZONA 5 COLONIA ENRIQUETA,66367482,DORA BEATRIZ BARRIOS CRUZ,OLGA FRITZEIDA CRUZ WOLTKE,BASICO,PRIVADO,RURAL,ABIERTA,MONOLINGUE,VESPERTINA,DIARIO(REGULAR),GUATEMALA SUR
01-15-6511-45,01-215,GUATEMALA,VILLA NUEVA,LICEO CRISTIANO BALUARTE DE LA ENSEÑANZA,"3A. AVENIDA, 8-55, ZONA 5, COLONIA ENRIQUETA",56618558,DORA BEATRIZ BARRIOS CRUZ,ROSA BEATRIZ MONROY MONZON,BASICO,PRIVADO,RURAL,ABIERTA,MONOLINGUE,VESPERTINA,DIARIO(REGULAR),GUATEMALA SUR
01-15-6568-45,,GUATEMALA,VILLA NUEVA,INSTITUTO PRIVADO MIXTO LINDA VISTA,7A. CALLE 3-40 ZONA 1 VILLA NUEVA,,,,BASICO,PRIVADO,URBANA,CERRADA TEMPORALMENTE,MONOLINGUE,MATUTINA,DIARIO(REGULAR),GUATEMALA SUR
01-15-6569-45,01-413,GUATEMALA,VILLA NUEVA,INSTITUTO PRIVADO MIXTO LINDA VISTA,7A. CALLE 3-40 ZONA 1,,AMARILIS RIVAS MEJIA DE DIAZ,,BASICO,PRIVADO,URBANA,CERRADA TEMPORALMENTE,MONOLINGUE,VESPERTINA,FIN DE SEMANA,GUATEMALA SUR
01-15-6570-45,01-413,GUATEMALA,VILLA NUEVA,INSTITUTO PRIVADO MIXTO LINDA VISTA,7A. CALLE 3-40 ZONA 1,,AMARILIS RIVAS MEJIA DE DIAZ,,BASICO,PRIVADO,URBANA,CERRADA TEMPORALMENTE,MONOLINGUE,VESPERTINA,FIN DE SEMANA,GUATEMALA SUR
01-15-6670-45,01-221,GUATEMALA,VILLA NUEVA,LICEO TECNICO DE VILLA NUEVA,6A. AV. 6-54 ZONA 1,66312603,DALLANA ZUHEIDY FLORES CHINCHILLA,IRIS MARICLO MORALES LUNA,BASICO,PRIVADO,URBANA,ABIERTA,MONOLINGUE,MATUTINA,DIARIO(REGULAR),GUATEMALA SUR
01-15-6700-45,01-411,GUATEMALA,VILLA NUEVA,LICEO TECNICO DE VILLA NUEVA,"6A. AVENIDA 6-54, ZONA 1",66312603,JUAN ENRIQUE MARTINEZ SOLANO,JAIME JOEL GIRON ALVAREZ,BASICO,PRIVADO,URBANA,CERRADA TEMPORALMENTE,MONOLINGUE,DOBLE,FIN DE SEMANA,GUATEMALA SUR
01-15-6719-45,01-214,GUATEMALA,VILLA NUEVA,COLEGIO PARTICULAR MIXTO ULISES ROJAS,"12AV. 5-62 ZONA 4, COLONIA LINDA VISTA",66306316,HECTOR RAUL ESCUN VIDES,IRIS VIOLETA SALAZAR PEÑA DE GODINEZ,BASICO,PRIVADO,URBANA,ABIERTA,MONOLINGUE,MATUTINA,DIARIO(REGULAR),GUATEMALA SUR
01-15-6721-45,01-216,GUATEMALA,VILLA NUEVA,CENTRO EDUCATIVO 'MANUEL GALICH',"5A. AVENIDA 2-76, COLONIA ETERNA PRIMAVERA",55745561,GLADYS IDALMA CHAVARRIA NIJ,,BASICO,PRIVADO,URBANA,ABIERTA,MONOLINGUE,VESPERTINA,DIARIO(REGULAR),GUATEMALA SUR
01-15-6726-45,01-216,GUATEMALA,VILLA NUEVA,CENTRO EDUCATIVO CRISTIANO 'LIGA DE VIDA NUEVA',5A. CALLE 15-20 ZONA 4 COLONIA LA ARADA,66278010,GLADYS IDALMA CHAVARRIA NIJ,,BASICO,PRIVADO,URBANA,ABIERTA,MONOLINGUE,MATUTINA,DIARIO(REGULAR),GUATEMALA SUR
01-15-6732-45,01-212,GUATEMALA,VILLA NUEVA,COLEGIO CRISTIANO 'HERMOSO JESUS',1A. CALLE 6-91 ZONA 6,66368660,HAROLDO ENRIQUE NAVAS PAZ,,BASICO,PRIVADO,URBANA,ABIERTA,MONOLINGUE,MATUTINA,DIARIO(REGULAR),GUATEMALA SUR
01-15-6773-45,01-212,GUATEMALA,VILLA NUEVA,COLEGIO MIXTO EVANGELICO 'JOSIAS',3A.CALLE 7-70 ZONA 1,66321712,HAROLDO ENRIQUE NAVAS PAZ,,BASICO,PRIVADO,URBANA,CERRADA TEMPORALMENTE,MONOLINGUE,VESPERTINA,DIARIO(REGULAR),GUATEMALA SUR
01-15-6796-45,01-219,GUATEMALA,VILLA NUEVA,COLEGIO EVANGELICO AMIGOS,"1A. AVENIDA B 0-01 ZONA 8, CIUDAD PERONIA",24785999,FLOR DE MARIA HERNANDEZ MOLINA,JOSUE EMANUEL CHAVEZ ANTONIO,BASICO,PRIVADO,URBANA,ABIERTA,MONOLINGUE,VESPERTINA,DIARIO(REGULAR),GUATEMALA SUR
01-15-6799-45,,GUATEMALA,VILLA NUEVA,COLEGIO LUZ Y SABIDURIA,5AV. 6-59 ZONA 12 COLONIA MEZQUITAL,,,,BASICO,PRIVADO,URBANA,CERRADA TEMPORALMENTE,MONOLINGUE,MATUTINA,DIARIO(REGULAR),GUATEMALA SUR
01-15-6803-45,01-210,GUATEMALA,VILLA NUEVA,ESCUELA CRISTIANA CAMINO DE LUZ,AV. PETAPA FINA LOTE 4 COLONIA LA CUCHILLA II ZONA 12,24776538,DINIZ ORALIA MORALES MUÑOZ,WALTER VASQUEZ SEGURA,BASICO,PRIVADO,URBANA,ABIERTA,MONOLINGUE,VESPERTINA,DIARIO(REGULAR),GUATEMALA SUR
01-15-6807-45,01-221,GUATEMALA,VILLA NUEVA,COLEGIO MIXTO EVANGELICO 'LA VERDAD',10AV. 3-95 ZONA 3 BARCENAS,66362284,DALLANA ZUHEIDY FLORES CHINCHILLA,,BASICO,PRIVADO,RURAL,CERRADA TEMPORALMENTE,MONOLINGUE,VESPERTINA,DIARIO(REGULAR),GUATEMALA SUR
01-15-6925-45,01-218,GUATEMALA,VILLA NUEVA,IEBC MARIO ALIOTO LOPEZ,EL ZARZAL COLONIA MARIO ALIOTO LOPEZ,42062001,BENIGNO ISAIAS DE LEON OROZCO,,BASICO,COOPERATIVA,URBANA,ABIERTA,MONOLINGUE,VESPERTINA,DIARIO(REGULAR),GUATEMALA SUR
01-15-6929-45,01-411,GUATEMALA,VILLA NUEVA,COLEGIO SABATINO LA SABIDURIA,4A. AVE. 1-65 ZONA 4 COLONIA VENECIA II,58945078,JUAN ENRIQUE MARTINEZ SOLANO,,BASICO,PRIVADO,URBANA,ABIERTA,MONOLINGUE,DOBLE,FIN DE SEMANA,GUATEMALA SUR
01-15-6930-45,01-411,GUATEMALA,VILLA NUEVA,COLEGIO SABATINO LA SABIDURIA,4A. AVE. 1-65 ZONA 4 COLONIA VENECIA II,58945078,JUAN ENRIQUE MARTINEZ SOLANO,,BASICO,PRIVADO,URBANA,ABIERTA,MONOLINGUE,DOBLE,FIN DE SEMANA,GUATEMALA SUR
01-15-6935-45,01-213,GUATEMALA,VILLA NUEVA,COLEGIO DIVINO SALVADOR,3A. AVE. A 2-71 ZONA 2,66794246,LILIANA LETICIA DUBON ESPINOZA,,BASICO,PRIVADO,URBANA,CERRADA TEMPORALMENTE,MONOLINGUE,VESPERTINA,DIARIO(REGULAR),GUATEMALA SUR
01-15-6945-45,,GUATEMALA,VILLA NUEVA,CENTRO DE ESTUDIOS DE INFORMATICA COMPUTACION Y TECNOLOGIA 'CEICT',1A. CALLE 5-89 ZONA 6,66313077,,,BASICO,PRIVADO,URBANA,CERRADA TEMPORALMENTE,MONOLINGUE,VESPERTINA,FIN DE SEMANA,GUATEMALA SUR
01-15-6973-45,01-206,GUATEMALA,VILLA NUEVA,IEBC 'OLIVERIO CASTAYEDA DE LEON',"EL EXODO, COLONIA MEZQUITAL.",24800853,INGRID ELIZABETH PEÑA TRUJILLO,,BASICO,COOPERATIVA,URBANA,CERRADA TEMPORALMENTE,MONOLINGUE,VESPERTINA,DIARIO(REGULAR),GUATEMALA SUR
01-15-6992-45,01-218,GUATEMALA,VILLA NUEVA,INEB DE TELESECUNDARIA,"3A. AVENIDA 7-89 ZONA 8, CIUDAD PERONIA",,BENIGNO ISAIAS DE LEON OROZCO,DIANA LISBETH ESTRADA PADILLA,BASICO,OFICIAL,RURAL,ABIERTA,MONOLINGUE,VESPERTINA,DIARIO(REGULAR),GUATEMALA SUR
01-15-6993-45,01-218,GUATEMALA,VILLA NUEVA,INEB DE TELESECUNDARIA LA ISLA,12AV 24-80 ZONA 12 VILLA LOBOS I,47042374,BENIGNO ISAIAS DE LEON OROZCO,DANIEL FRANCISCO RAMOS PEREZ,BASICO,OFICIAL,RURAL,ABIERTA,MONOLINGUE,VESPERTINA,DIARIO(REGULAR),GUATEMALA SUR
01-15-6994-45,,GUATEMALA,VILLA NUEVA,INEB DE TELESECUNDARIA,"25 CALLE 6-21 ZONA 12, COLONIA VILLA LOBOS I",24780118,,,BASICO,OFICIAL,URBANA,CERRADA TEMPORALMENTE,MONOLINGUE,VESPERTINA,DIARIO(REGULAR),GUATEMALA SUR
01-15-7005-45,,GUATEMALA,VILLA NUEVA,INEB DE TELESECUNDARIA 'MARTIRES DEL PUEBLO',ASENTAMIENTO MARTIRES DEL PUEBLO FINCA EL ZARZAL,,,,BASICO,OFICIAL,URBANA,CERRADA TEMPORALMENTE,MONOLINGUE,VESPERTINA,DIARIO(REGULAR),GUATEMALA SUR
01-15-7006-45,,GUATEMALA,VILLA NUEVA,INEB DE TELESECUNDARIA,CASERIO EL CALVARIO,,,,BASICO,OFICIAL,RURAL,CERRADA TEMPORALMENTE,MONOLINGUE,VESPERTINA,DIARIO(REGULAR),GUATEMALA SUR
01-15-7007-45,01-218,GUATEMALA,VILLA NUEVA,INEB DE TELESECUNDARIA,"2A. CALLE 11-98 ZONA 2, RESIDENCIALES VILLA LOBOS SUR",53516670,BENIGNO ISAIAS DE LEON OROZCO,AURA LETICIA MAZARIEGOS BARILLAS,BASICO,OFICIAL,RURAL,ABIERTA,MONOLINGUE,VESPERTINA,DIARIO(REGULAR),GUATEMALA SUR
01-15-7026-45,01-214,GUATEMALA,VILLA NUEVA,COLEGIO CRISTIANO EL OLIVO,12 AVENIDA B 2-08 ZONA 2 SAN JOSE VILLA NUEVA,66353256,HECTOR RAUL ESCUN VIDES,JUANA ELIZABETH ROMPICH XOLIX,BASICO,PRIVADO,URBANA,ABIERTA,MONOLINGUE,MATUTINA,DIARIO(REGULAR),GUATEMALA SUR
01-15-7027-45,,GUATEMALA,VILLA NUEVA,COLEGIO CRISTIANO EL OLIVO,ALDEA SAN JOSE,,,,BASICO,PRIVADO,URBANA,CERRADA TEMPORALMENTE,MONOLINGUE,VESPERTINA,DIARIO(REGULAR),GUATEMALA SUR
01-15-7064-45,01-411,GUATEMALA,VILLA NUEVA,LICEO MIXTO CRISTIANO 'PIAGET',2A. AV. 4-60 ZONA 12 CIUDAD REAL I,42190100,JUAN ENRIQUE MARTINEZ SOLANO,,BASICO,PRIVADO,URBANA,ABIERTA,MONOLINGUE,DOBLE,FIN DE SEMANA,GUATEMALA SUR
01-15-7071-45,01-221,GUATEMALA,VILLA NUEVA,CENTRO EDUCATIVO INTEGRAL MIXTO FUENTE DE SAN JOSE,"LOTE 39 COLONIA JACARANDA, SAN JOSE VILLA NUEVA",66619815,DALLANA ZUHEIDY FLORES CHINCHILLA,,BASICO,PRIVADO,URBANA,ABIERTA,MONOLINGUE,VESPERTINA,DIARIO(REGULAR),GUATEMALA SUR
01-15-7073-45,,GUATEMALA,VILLA NUEVA,CENTRO EDUCATIVO INTEGRAL MIXTO FUENTE DE SAN JOSE,LOTE 39COLONIA LA JACARANDA,66363781,,,BASICO,PRIVADO,URBANA,CERRADA TEMPORALMENTE,MONOLINGUE,INTERMEDIA,DIARIO(REGULAR),GUATEMALA SUR
01-15-7078-45,01-411,GUATEMALA,VILLA NUEVA,CENTRO EDUCATIVO MIXTO FUENTE DE SAN JOSE,LOTE 39 COLONIA JACARANDA,66619815,JUAN ENRIQUE MARTINEZ SOLANO,,BASICO,PRIVADO,URBANA,ABIERTA,MONOLINGUE,DOBLE,FIN DE SEMANA,GUATEMALA SUR
01-15-7103-45,01-213,GUATEMALA,VILLA NUEVA,COLEGIO CRISTIANO MIXTO SION,23 CALLE 14-50 ZONA 12 VILLA LOBOS I,659-3910 297-9028,LILIANA LETICIA DUBON ESPINOZA,,BASICO,PRIVADO,URBANA,CERRADA TEMPORALMENTE,MONOLINGUE,VESPERTINA,DIARIO(REGULAR),GUATEMALA SUR
01-15-7121-45,01-411,GUATEMALA,VILLA NUEVA,COLEGIO EVANGELICO MIXTO GUATEMALA,4TA. AVE. 4-34 ZONA 1,52182905,JUAN ENRIQUE MARTINEZ SOLANO,,BASICO,PRIVADO,URBANA,CERRADA TEMPORALMENTE,MONOLINGUE,VESPERTINA,FIN DE SEMANA,GUATEMALA SUR
01-15-7201-45,01-215,GUATEMALA,VILLA NUEVA,CENTRO EDUCATIVO 'AMOR Y ENSEÑANZA',12 AVENIDA 8-95 ZONA 3 BARCENAS,66369570,DORA BEATRIZ BARRIOS CRUZ,,BASICO,PRIVADO,URBANA,CERRADA TEMPORALMENTE,MONOLINGUE,VESPERTINA,DIARIO(REGULAR),GUATEMALA SUR
01-15-7203-45,01-411,GUATEMALA,VILLA NUEVA,CENTRO EDUCATIVO 'AMOR Y ENSEÑANZA',12AV 8-95 ZONA 3 BARCENA,55956939,JUAN ENRIQUE MARTINEZ SOLANO,,BASICO,PRIVADO,URBANA,CERRADA TEMPORALMENTE,MONOLINGUE,VESPERTINA,FIN DE SEMANA,GUATEMALA SUR
01-15-7205-45,01-411,GUATEMALA,VILLA NUEVA,CENTRO EDUCATIVO AMOR Y ENSEÑANZA,12 AVENIDA 8-95 ZONA 3 BARCENAS,55956939,JUAN ENRIQUE MARTINEZ SOLANO,,BASICO,PRIVADO,URBANA,CERRADA TEMPORALMENTE,MONOLINGUE,NOCTURNA,DIARIO(REGULAR),GUATEMALA SUR
01-15-7223-45,01-213,GUATEMALA,VILLA NUEVA,COLEGIO 'AMOR Y SABIDURIA',10A. CALLE 5-05 RESIDENCIALES CATALINA ZONA 6,66312601,LILIANA LETICIA DUBON ESPINOZA,,BASICO,PRIVADO,URBANA,ABIERTA,MONOLINGUE,MATUTINA,DIARIO(REGULAR),GUATEMALA SUR
01-15-7225-45,01-411,GUATEMALA,VILLA NUEVA,COLEGIO 'AMOR Y SABIDURIA',10A CALLE 5-05 RESIDENCIALES CATALINA ZONA 6,66311227,JUAN ENRIQUE MARTINEZ SOLANO,,BASICO,PRIVADO,URBANA,ABIERTA,MONOLINGUE,DOBLE,FIN DE SEMANA,GUATEMALA SUR
01-15-7254-45,01-214,GUATEMALA,VILLA NUEVA,COLEGIO CAMINO VERDE,KM. 1.2 ALTOS DE BARCENAS I,66293874,HECTOR RAUL ESCUN VIDES,,BASICO,PRIVADO,URBANA,ABIERTA,MONOLINGUE,MATUTINA,DIARIO(REGULAR),GUATEMALA SUR
01-15-7422-45,01-212,GUATEMALA,VILLA NUEVA,"""LICEO EL CARMEN""",9A. AVE. A 1-22 ZONA 1,66313880,HAROLDO ENRIQUE NAVAS PAZ,MARIA ELENA MONTUFAR GIRON,BASICO,PRIVADO,URBANA,CERRADA TEMPORALMENTE,MONOLINGUE,MATUTINA,DIARIO(REGULAR),GUATEMALA SUR
01-15-7424-45,01-212,GUATEMALA,VILLA NUEVA,COLEGIO MONTEVISION,9A. AVE. 'A' 1-22 ZONA 1,,HAROLDO ENRIQUE NAVAS PAZ,,BASICO,PRIVADO,URBANA,CERRADA TEMPORALMENTE,MONOLINGUE,VESPERTINA,DIARIO(REGULAR),GUATEMALA SUR
01-15-7437-45,01-213,GUATEMALA,VILLA NUEVA,COLEGIO LUIS REY,9A.CALLE 17-48 ZONA 6 PLANES DEL FRUTAL,66596063-66357276,LILIANA LETICIA DUBON ESPINOZA,,BASICO,PRIVADO,URBANA,CERRADA TEMPORALMENTE,MONOLINGUE,MATUTINA,DIARIO(REGULAR),GUATEMALA SUR
01-15-7456-45,01-216,GUATEMALA,VILLA NUEVA,COLEGIO PARTICULAR MIXTO CENTROAMERICANO,5TA. CALLE 3-22 ZONA 5 COLONIA ENRIQUETA,66321780,GLADYS IDALMA CHAVARRIA NIJ,,BASICO,PRIVADO,RURAL,CERRADA TEMPORALMENTE,MONOLINGUE,MATUTINA,DIARIO(REGULAR),GUATEMALA SUR
01-15-7457-45,01-219,GUATEMALA,VILLA NUEVA,COLEGIO PARTICULAR MIXTO CENTROAMERICANO,5A. AV. 3-22 ZONA 5 COLONIA ENRIQUETA,66317671,FLOR DE MARIA HERNANDEZ MOLINA,,BASICO,PRIVADO,URBANA,CERRADA TEMPORALMENTE,MONOLINGUE,VESPERTINA,FIN DE SEMANA,GUATEMALA SUR
01-15-7459-45,,GUATEMALA,VILLA NUEVA,COLEGIO MIXTO NOCTURNO LA ILUSTRACION,1A. AV. A 2-09 ZONA 2 SAN JOSE VILLA NUEVA,66311359,,,BASICO,PRIVADO,URBANA,CERRADA TEMPORALMENTE,MONOLINGUE,MATUTINA,SABATINO,GUATEMALA SUR
01-15-7461-45,01-411,GUATEMALA,VILLA NUEVA,COLEGIO MIXTO NOCTURNO LA ILUSTRACION,1A. AV. A 2-09 ZONA 2 SAN JOSE VILLA NUEVA,66311359,JUAN ENRIQUE MARTINEZ SOLANO,,BASICO,PRIVADO,URBANA,CERRADA TEMPORALMENTE,MONOLINGUE,NOCTURNA,DIARIO(REGULAR),GUATEMALA SUR
01-15-7468-45,01-413,GUATEMALA,VILLA NUEVA,CENTRO DE ESTUDIOS MERCADOLOGICOS Y PUBLICITARIOS,4TA. CALLE 9-20 ZONA 1,66320265,AMARILIS RIVAS MEJIA DE DIAZ,,BASICO,PRIVADO,URBANA,CERRADA TEMPORALMENTE,MONOLINGUE,VESPERTINA,DIARIO(REGULAR),GUATEMALA SUR
01-15-7540-45,01-207,GUATEMALA,VILLA NUEVA,COLEGIO MIXTO 'CAMINO AL EXITO',"3A. AVENIDA 51-08 ZONA 12, COLONIA VILLALOBOS II",24798117,LUZ ANTONIA POCON CARRILLO,,BASICO,PRIVADO,URBANA,ABIERTA,MONOLINGUE,VESPERTINA,DIARIO(REGULAR),GUATEMALA SUR
01-15-7646-45,01-212,GUATEMALA,VILLA NUEVA,INSTITUTO PROFESIONAL DE COMPUTACION,7A. CALLE 3-40 ZONA 1,66363334,HAROLDO ENRIQUE NAVAS PAZ,,BASICO,PRIVADO,URBANA,ABIERTA,MONOLINGUE,MATUTINA,DIARIO(REGULAR),GUATEMALA SUR
01-15-7652-45,01-215,GUATEMALA,VILLA NUEVA,CENTRO EDUCATIVO EL SANTUARIO,"14 AVENIDA 7-43 ZONA 1, COLONIA SAN MIGUELITO",52261991,DORA BEATRIZ BARRIOS CRUZ,SILVIA LETICIA RUANO RAMIREZ,BASICO,PRIVADO,RURAL,ABIERTA,MONOLINGUE,VESPERTINA,DIARIO(REGULAR),GUATEMALA SUR
01-15-7694-45,01-411,GUATEMALA,VILLA NUEVA,COLEGIO EVANGELICO MIXTO 'EL MESIAS' (POR MADUREZ),"12 AVENIDA 4-98 ZONA 4 COLONIA LINDA VISTA, VILLA NUEVA",42509696,JUAN ENRIQUE MARTINEZ SOLANO,,BASICO,PRIVADO,URBANA,ABIERTA,MONOLINGUE,DOBLE,FIN DE SEMANA,GUATEMALA SUR
01-15-7697-45,01-411,GUATEMALA,VILLA NUEVA,COLEGIO RAFAEL AREVALO MARTINEZ,7A. AVE. 7-55 ZONA 3,66293423,JUAN ENRIQUE MARTINEZ SOLANO,ANA PATRICIA GUAMUCH TUBAC,BASICO,PRIVADO,RURAL,ABIERTA,MONOLINGUE,DOBLE,FIN DE SEMANA,GUATEMALA SUR
01-15-7731-45,01-411,GUATEMALA,VILLA NUEVA,"""LICEO EL CARMEN""",9A. AVE. A 1-22 ZONA 1,66313880,JUAN ENRIQUE MARTINEZ SOLANO,MARIA ELENA MONTUFAR GIRON,BASICO,PRIVADO,URBANA,CERRADA TEMPORALMENTE,MONOLINGUE,DOBLE,FIN DE SEMANA,GUATEMALA SUR
01-15-7732-45,01-411,GUATEMALA,VILLA NUEVA,"""LICEO EL CARMEN""",9A. AVE. A 1-22 ZONA 1,66365889,JUAN ENRIQUE MARTINEZ SOLANO,MARIA ELENA MONTUFAR GIRON,BASICO,PRIVADO,URBANA,CERRADA TEMPORALMENTE,MONOLINGUE,DOBLE,FIN DE SEMANA,GUATEMALA SUR
01-15-7753-45,01-411,GUATEMALA,VILLA NUEVA,LICEO BILINGUE AMERICANO 'VERA ELISA',"9A. AVENIDA 1-60 ZONA 5, COLONIA EL FRUTAL",56134501,JUAN ENRIQUE MARTINEZ SOLANO,,BASICO,PRIVADO,URBANA,ABIERTA,MONOLINGUE,DOBLE,FIN DE SEMANA,GUATEMALA SUR
01-15-7765-45,01-215,GUATEMALA,VILLA NUEVA,COLEGIO MIXTO RUBEN DARIO,6A. CALLE 11-49 ZONA 3 ALDEA BARCENAS,66294935,DORA BEATRIZ BARRIOS CRUZ,,BASICO,PRIVADO,URBANA,ABIERTA,MONOLINGUE,VESPERTINA,DIARIO(REGULAR),GUATEMALA SUR
01-15-7792-45,01-216,GUATEMALA,VILLA NUEVA,COLEGIO CRISTIANO BILINGUE 'GENERACION DE JOSUE',3A. CALLE 13-80 ZONA 1,66363413,GLADYS IDALMA CHAVARRIA NIJ,,BASICO,PRIVADO,URBANA,ABIERTA,MONOLINGUE,MATUTINA,DIARIO(REGULAR),GUATEMALA SUR
01-15-7856-45,01-411,GUATEMALA,VILLA NUEVA,INSTITUTO MIXTO NOCTURNO EL ANGEL,1A. CALLE 1-63 ZONA 5,66313297-58984749,JUAN ENRIQUE MARTINEZ SOLANO,ILMA SERAFINA VILLEDA PORRAS,BASICO,PRIVADO,URBANA,CERRADA TEMPORALMENTE,MONOLINGUE,NOCTURNA,DIARIO(REGULAR),GUATEMALA SUR
01-15-7857-45,01-411,GUATEMALA,VILLA NUEVA,INSTITUTO MIXTO NOCTURNO EL ANGEL,1A. CALLE 1-63 ZONA 5,54279122,JUAN ENRIQUE MARTINEZ SOLANO,ILMA SERAFINA VILLEDA PORRAS,BASICO,PRIVADO,URBANA,ABIERTA,MONOLINGUE,DOBLE,FIN DE SEMANA,GUATEMALA SUR
01-15-7900-45,01-411,GUATEMALA,VILLA NUEVA,COLEGIO 'AMOR Y SABIDURIA' (POR MADUREZ),"10A. CALLE 5-05 ZONA 6, RESIDENCIALES CATALINA",66312601,JUAN ENRIQUE MARTINEZ SOLANO,,BASICO,PRIVADO,URBANA,ABIERTA,MONOLINGUE,DOBLE,FIN DE SEMANA,GUATEMALA SUR
01-15-7932-45,01-218,GUATEMALA,VILLA NUEVA,IEBC LIC. ALVARO CANO,COLONIA LAS MARGARITAS EL BUCARO,24798882,BENIGNO ISAIAS DE LEON OROZCO,BLANCA TRINIDAD BARTOLÓN LAPARRA,BASICO,COOPERATIVA,URBANA,ABIERTA,MONOLINGUE,VESPERTINA,DIARIO(REGULAR),GUATEMALA SUR
01-15-8073-45,01-213,GUATEMALA,VILLA NUEVA,COLEGIO CRISTIANO 'ELIM SUR',"6A. CALLE 5-56 RESIDENCIALES CATALINA, ZONA 6",66357609,LILIANA LETICIA DUBON ESPINOZA,,BASICO,PRIVADO,URBANA,CERRADA TEMPORALMENTE,MONOLINGUE,MATUTINA,DIARIO(REGULAR),GUATEMALA SUR
01-15-8074-45,01-215,GUATEMALA,VILLA NUEVA,CENTRO EDUCATIVO JOSE MILLA Y VIDAURRE,2A. CALLE 2-43 ZONA 1,66364010,DORA BEATRIZ BARRIOS CRUZ,IRIS EUNICE ROSALES CHAVEZ,BASICO,PRIVADO,URBANA,ABIERTA,MONOLINGUE,MATUTINA,DIARIO(REGULAR),GUATEMALA SUR
01-15-8125-45,01-212,GUATEMALA,VILLA NUEVA,COLEGIO MIXTO ESMERALDA,3AV. 4-33 ZONA 1,66311141,HAROLDO ENRIQUE NAVAS PAZ,,BASICO,PRIVADO,URBANA,CERRADA TEMPORALMENTE,MONOLINGUE,MATUTINA,DIARIO(REGULAR),GUATEMALA SUR
01-15-8178-45,01-214,GUATEMALA,VILLA NUEVA,COLEGIO CRISTIANO CAMINO DEL SABER SUR,1A. AV. 2-56 ZONA 4 COLONIA PRADOS DE SONORA,66367591,HECTOR RAUL ESCUN VIDES,,BASICO,PRIVADO,URBANA,CERRADA TEMPORALMENTE,MONOLINGUE,MATUTINA,DIARIO(REGULAR),GUATEMALA SUR
01-15-8179-45,01-212,GUATEMALA,VILLA NUEVA,COLEGIO EVANGELICO MIXTO GUATEMALA,4TA. AV. 4-34 ZONA 1,58280827,HAROLDO ENRIQUE NAVAS PAZ,,BASICO,PRIVADO,URBANA,ABIERTA,MONOLINGUE,MATUTINA,DIARIO(REGULAR),GUATEMALA SUR
01-15-8213-45,01-641,GUATEMALA,VILLA NUEVA,COLEGIO PARTICULAR MIXTO DIOS DE ISRAEL,5A. AV. 7-48 MEZQUITAL ZONA 12,24798092,SERGIO ALEJANDRO VILLATORO VILLAGRAN,,BASICO,PRIVADO,URBANA,ABIERTA,MONOLINGUE,VESPERTINA,FIN DE SEMANA,GUATEMALA SUR
01-15-8222-45,01-213,GUATEMALA,VILLA NUEVA,LICEO MIXTO EVEREST,8A. AV. 11-16 ZONA 3 SANTA ISABEL II,66360564,LILIANA LETICIA DUBON ESPINOZA,,BASICO,PRIVADO,URBANA,ABIERTA,MONOLINGUE,MATUTINA,DIARIO(REGULAR),GUATEMALA SUR
01-15-8269-45,01-219,GUATEMALA,VILLA NUEVA,CENTRO EDUCATIVO 'LOS ROSALES',5A. CALLE 7-41 ZONA 1,66313477,FLOR DE MARIA HERNANDEZ MOLINA,,BASICO,PRIVADO,URBANA,CERRADA TEMPORALMENTE,MONOLINGUE,VESPERTINA,DIARIO(REGULAR),GUATEMALA SUR
01-15-8270-45,01-207,GUATEMALA,VILLA NUEVA,COLEGIO CRISTIANO 'BEZALEEL',"3A. AVENIDA 25-91 ZONA 12, VILLALOBOS I",24797359,LUZ ANTONIA POCON CARRILLO,,BASICO,PRIVADO,URBANA,CERRADA TEMPORALMENTE,MONOLINGUE,VESPERTINA,DIARIO(REGULAR),GUATEMALA SUR
